text,label,attack_type,original_text
即日产品快讯：保本保收益类：稳添利（41天3.7％，92天4％，179天4.05％）；预期类：59天4.15％，120天4.25％；今日沃德金基础金价281.1元/克，详询83309186 发送人:湖景支行【佛山交行】,1,,
I WILL CAL YOU SIR. In meeting,0,,
Hey so this sat are we going for the intro pilates only? Or the kickboxing too? ,0,,
【3G精品小贴士】母亲节速递——成长的速度一定要超过母亲老去的速度，点击查看如何关爱母亲： http://202.102.41.22/ds.jsp?ms=b10007731b10001403a151259,1,,
"Yar lor he wan 2 go c horse racing today mah, so eat earlier lor. I ate chicken rice. U?",0,,
360权惠-商运:好的，那现在？,0,,
"今天带学入(000060中金岭南)明拉绝对精彩,关注勿追!合双赢才是硬道理!约明日布入线 0752-8467268【惠丰基】",1,A,"今天带学员入(000060中金岭南)明日拉绝对精彩,关注勿追!合作双赢才是硬道理!预约明日午盘布入内线 0752-8467268【惠丰基金】"
I will once i get home,0,,
您尾号4118的招行信用卡在08月02日12时55分发生消费人民币276.00元。[招商银行],0,,
幸福就是：看看电视听听歌，喝着啤酒唱唱歌，找个朋友唠唠嗑，品品清茶玩会牌，接接电话好运来！祝好朋友和家人周末愉快，健康幸福！龙源经理=徐子涵,0,,
元祖端午“蒸味之旅”大型巡展活动开幕，现场惊喜等您来，还有限量好礼哦！详情请洽www.ganso.com.cn,1,,
想看紧钱包又想疯狂购物？凡客品牌特卖周每天上午10点与您不见不散！今日特惠：李宁、韩版女装乔伊思19元起抢 vancl.com[凡客诚品],1,,
True lov n care wil nevr go unrecognized. though somone often makes mistakes when valuing it. but they will definitly undrstnd once when they start missing it.,0,,
尊敬的会员您好，5月烫染季双重折扣，钜惠全城！活动截止5月31号！另会员卡升级成磁卡截止到6月31日，详询85731347【椰岛万松园店】,1,,
“你摊上事了，你摊上好事了”天津金利园现房，速办蓝印户口保送静海一中就读，上名牌大学，名额有限，先到先得 0317-5660222,1,,
和烧肉日料推出限量99元寿喜锅套餐，含：前菜、刺身拼盘、烧物、寿喜锅、乌冬面、水果。每日仅10份！预定36618608【昆山兰博基尼酒店】,1,,
【携程网】【回复0000可屏蔽】上海市长宁区金钟路999号A楼携程旅行网7楼国内机票预订部 收件人：退改区黄健民/陈佳妮 分机021-34064880*454193 邮编：200335,0,,
下午五点/*半来容/和大酒店吃饭（东关十字南）,1,B,下午五点半来容和大酒店吃饭（东关十字南）
咯经济,0,,
^美媒曝光中国地下空军:不可战胜[#搜^狐]-中|国移动冲浪助手:http.://go#.10086.cn*/|nd//mgp/12m6Dq,1,B,美媒曝光中国地下空军:不可战胜[搜狐]-中国移动冲浪助手:http://go.10086.cn/nd/mgp/12m6Dq
"Okey doke. I'm at home, but not dressed cos laying around ill! Speak to you later bout times and stuff. ",0,,
下手慢一点，后悔一辈子！金鼎公园尚无可比拟的性价比，4380元/平起抢洋湖垸实景准现房，78-139㎡绝版公园华宅开盘在即88853555,1,,
A股双向交易平台可买涨、买跌当天随时买进卖出，获利提速，资金杠杆100倍，入金即送5！登录www.93589.com【鑫金融】,1,,
5.17日至5.19日拨打联通114预定关东文化园门票，都市温泉享受，尽享贵宾服务，低价格高品质。详情请拨打114。,1,,
（沧州沃活动二）亲爱的联通沃友，上午好！你的流量达50M了吗？沧州联通3G客户月上网流量达到50M，次月即可参加“达量抽奖”！奖项设置：特等奖1名(流量达500M以上）：奖2000元礼品；一等奖5名(300M以上）：奖1000元礼品；二等奖10名(50M以上)：奖500元礼品，还有千名幸运奖哦！发送短信3G到10655317报名参与吧。沃亲，你达到了吗？一起看视频吧--5月13日NBA官方5佳球精彩集锦http://plays.video.sina.com.cn/?sa=d924701t424v2696&vt=4&t=&wm=,1,,
纸袋碰腿北京2孕妇地铁内互殴[人民]-中国移动冲浪助手:http://go.10086.cn/nd/mgV/NOkC8,1,,
天府新城CBD，纯租赁超甲精装写字楼【通威国际中心】，世界500强、国内知名企业高端商务平台，5.18全球招商启幕！86168686【通威】,1,,
直击股市：大盘放量强势反弹，炒股赚钱正当时；现在加入实盘指导Q群：286188564，盘前潜力股推荐，盘中直击市场热点，免费指导【益盟操盘手】,1,,
美媒曝光中国地下空军:不可战胜[搜狐]-中国移动冲浪助手:http://go.10086.cn/nd/mgp/171BM1,1,,
全新现 房5680元/平米起！大兴70年产权自由购， 地铁4号线首站花园洋房，即买即住！绝佳居住养生：咨询热线 4006119719,1,,
您好！请抽空到群共享中核对一下子兰学堂报名情况，如出入，请发短给我，谢！ 时代小－姜雯,1,A,您好！请大家抽空到群共享中核对一下孩子的蕙兰学堂报名情况，如有出入，请发短信给我，谢谢！ 时代小学－姜雯
今天夜里到明天多云转阴有阵雨，明_天下午到后天|阴有中到大阵雨或雷雨，/局^部有暴雨。明日气温20到26℃。缙.云县气*象台14日1/5*时发*布。,1,B,今天夜里到明天多云转阴有阵雨，明天下午到后天阴有中到大阵雨或雷雨，局部有暴雨。明日气温20到26℃。缙云县气象台14日15时发布。
HR王琦楠:另外关于股票的问题，依据你股票的授予时间，应该是2011年以后签署的授予协议，因此是90天内行权。,0,,
Happy birthday... May u find ur prince charming soon n dun work too hard...,0,,
马头新型社区，实景现房，购房零风险，一期少量房源，可办理20年按揭付款，地址:银河路北段体育场对面8218999/3226611【杞县城郊】,1,,
600000浦发银行：公司正与上海国际集团有限公司研究受让上海国际信托公司控股权等事宜，具体方案尚在研究过程中。今日复牌。(仅供参考，以沪深交易所公告为准)。【招商证券】,0,,
首次使用掌上生活还款即可获赠199积分！点 t.cn/RvaCphh 了解下载掌上生活即刻还款，支持11家银行，跨行还款0手续费[招商银行],0,,
温馨提示，截至11月16日，您当月套餐内流量已使用0.00 MB，剩余流量300.00 MB。登录联通网上营业厅www.10010.,0,,
我是歌手正版歌曲全面登陆爱音乐客户端，“爱不爱我-周晓欧”，“回来-黄绮珊”，立刻升级爱音乐客户端，就能免费试听、下载，还能订购为手机彩铃。点击升级： http://www.118100.cn/app/1157 中国电信,1,,
Jason says it's cool if we pick some up from his place in like an hour,0,,
It took Mr owl 3 licks,0,,
美多装饰 专家品质！美多装饰公司祝您每天好心情，工作顺利，身体健康。美多装饰愿与您合作愉快！详询2380599,1,,
"It's wylie, you in tampa or sarasota?",0,,
"幽默短信:旅馆走廊挂着一块牌子,上写:请夜间保持安静,切勿打扰旅客休息.后来人们发现牌子上这行字的下面又添了一行小字:要是老鼠也认字该多好",0,,
爆二货老外人囧事集锦  http://g.wo.com.cn/h1M/9qaOLw&h=1&f=a11Hh,1,A,爆笑二货老外雷人囧事集锦  http://g.wo.com.cn/h1M/9qaOLw&h=1&f=a11Hh
", ow u dey.i paid 60,400thousad.i told  u would call . ",0,,
... Are you in the pub?,0,,
教育培训招生、企业管理培训的好帮手：定向自由飞信可经济、精准、快速的帮您找到您的客户源。预约电话：13938445736,1,,
世界五百强欧尚超市进驻【汇仁阳光花园】！户户大赠送，地铁学区房2千抵2万认筹倒计时！本周末精彩活动有豪礼85709999【汇仁地产】,1,,
花朵的灿烂，引来蝴蝶的飞舞，让春天更生动；理想的远大，带来无限激情，让人生更精彩；简单的问候，包含美好祝福，愿你生活更幸福。祝你开心！,0,,
We tried to contact you re your reply to our offer of 750 mins 150 textand a new video phone call 08002988890 now or reply for free delivery tomorrow,1,,
凤岗粤BR1761订舱号#1^81AY13~H01B094|524柜号T|RIU9841433封^条号FEJ276*8^80_6栗功行~15813832189,1,B,凤岗粤BR1761订舱号181AY13H01B094524柜号TRIU9841433封条号FEJ2768806栗功行15813832189
财富早间版：证监会推动优先股试点市场传闻蓝筹股或将T+0交易；权威机构预测2月CPI同比增2%连续五个月放缓。经历前期回调后市场有超跌反弹要求，其高度不宜过分乐观，轻仓投资者可适当关注业绩优良的商业零售、医药等品种的反弹机会。投资建议仅供参考。【招商证券】,0,,
我没时间跟你啰嗦，要睡觉了,1,,
鹰潭外国语学校、江西广播电视艺术幼儿园入主月湖新城，国际化一站式教育即将呈现，开启新月湖新中心国际教育基地6667777【绿地月湖国际星城】,1,,
【让您孩子轻松学】元城唐山劲盘，城中心珍藏户型，个月下发蓝印户，不蓝印退房款再赔付30万补偿金！电话4000082000,1,A,【让您的孩子轻松考大学】状元城唐山劲爆开盘，城中心珍藏小户型，三个月下发蓝印户口，不下蓝印退房款再赔付30万补偿金！电话4000082000
家族愈鼎盛择地愈稀缺！颐和高尔夫庄园据城央南湖云山龙脉地，钜献千平果岭养生山墅，享领袖级养生旺家族万代，不限购不限贷即买即住86059168,1,,
“酷热夏季，冰点钜惠”五一热堵挤出行难，盛邀莅临【北宸?御景】逛花园品凉茶。1期近售罄2期盛夏入市，买到即是赚到！8848158【浩跃地产】,1,,
恭喜您获得双金刷卡促动活动积分，回复@525#证件后四位可抽奖新秀丽电脑包、乐扣保鲜盒提袋套装。系统将使用您本活动全部积分为您运行3次抽奖并告知您抽奖结果，2月28日前回复有效。[招商银行],0,,
亲们周末好，现在市场依然活跃想买房卖房抓紧了哦外出关窗锁门游玩注意安全中原小戚敬上15018500237取消订阅回复0000【中原地产】,1,,
"-动感地带快讯，您有1条飞信消息未读,点此查看",1,,
我希望我们白头到老,1,,
您申请的动态密码为: zNYYHc,0,,
信阳国际茶城即将盛惠开 盘，认 筹开始每天立减200元，交1万抵5万。超值优 惠超高回 报。详询0376-3309999【精准信息】,1,,
汉正古镇准现房热销中，购现金钜惠。房源即将，仿古商街临街旺铺接受咨询，来访即赠精水杯，老新送卡8105222【数技术】,1,A,汉正古镇准现房热销中，购房现金钜惠。新品房源即将认筹，仿古商业街临街旺铺接受咨询，来访即赠精美水杯，老带新送购物卡8105222【数字技术】
本周六日大型澳大利亚房产展在上海明天广场万豪酒店5楼举行，首付20万毗邻顶级名校，澳洲房产移民留学一站式服务4001825388【澳信集团】,1,,
【3G应贴士】超级神马不需，有木有！黄金、NewPad等大奖，要不要！！参“苏电信 翼起来掼蛋”争霸赛成理想？现在练手来得！【掼蛋】免费加下载地址：http://202.102.41.22/ds.jsp?ms=b10009383b10001765a100656,1,A,【3G应用小贴士】超级豆神马的不需要，有木有！黄金、NewPad等大奖，要不要！！参加“江苏电信 翼起来掼蛋”争霸赛成绩不理想？现在练手还来得及！【掼蛋】免费参加下载地址：http://202.102.41.22/ds.jsp?ms=b10009383b10001765a100656
汉正古镇准现房.热销中，购房现金钜惠。新品房源即将认筹|，仿*古商业^街临街旺铺接受*咨询，~来访即赠精美水杯.，老带新送购物卡8105222【数字.#*技术】,1,B,汉正古镇准现房热销中，购房现金钜惠。新品房源即将认筹，仿古商业街临街旺铺接受咨询，来访即赠精美水杯，老带新送购物卡8105222【数字技术】
还在担心骚扰电话，隐私泄漏么？让“360手机安全卫士”为你保驾护航吧，一键式安全扫描，手机加速，为您带来全方位隐私保护，让手机卸掉重担，运转如飞！亲，联通用户免流量费下载哟！下载地址：       http://hao.hb165.com/i/1/lqVbX4ln,1,,
即起至630日，至易租车城港路店刷兴行信用卡享租一送一超值体验，每卡限享天，多优惠询租车热4008801580,1,A,即日起至6月30日，至易租车城港路店刷兴业银行信用卡可享租一送一超值体验，每卡限享一天，更多优惠询易租车热线4008801580
【海航】海航手机客户端购票直减享最惠！还有高舱双倍里程奖励、超值升舱惊喜、专享特斯拉接送机等礼遇恭候，即刻下载m.hnair.com,0,,
"A few people are at the game, I'm at the mall with iouri and kaila",0,,
This pen thing is beyond a joke. Wont a Biro do? Don't do a masters as can't do this ever again! ,0,,
"您好，我公司有做帐补帐。商业，设备，建材，广告，设计,科技等正规发/票开，营改增咨询可走帐。何珍宝18018785188合作。顺祝你身体健康",1,,
Call me when you get the chance plz &lt;3,0,,
"Û_ we r stayin here an extra week, back next wed. How did we do in the rugby this weekend? Hi to and and , c u soon \""ham""",0,,
美媒曝光中国地下空军:不可战胜[搜狐]-中国移动冲浪助手:http://go.10086.cn/nd/mgp/lqnM9,1,,
Its sarcasm.. .nt scarcasim,0,,
"Hi /#babe i.ts Jordan, how r u? I#m *ho_me from abroad/ an/d lonely, ~text me ba|ck i#f u wann^a chat xx^_SP v^isio_nsms.com~ Text stop_ |_to _stopCost 150p 0871240060#3",1,B,"Hi babe its Jordan, how r u? Im home from abroad and lonely, text me back if u wanna chat xxSP visionsms.com Text stop to stopCost 150p 08712400603"
Wat time Ì_ wan today?,0,,
"I feel like a dick because I keep sleeping through your texts and facebook messages. Sup, you in town?",0,,
8.17旅游达人分享会，带您踏上多瑙河奥德捷匈四国10日河轮之旅，啤酒节畅饮，新天鹅堡，文化沙龙。报名活动回G，退订回T【众信旅游】,0,,
【国美在线】会员您好【平板电脑惊爆299元】怎么会一百元都不给？全场直降百元起 t.cn/RzZLGYE 退订回T,0,,
【浦发信用卡中心】6-7月持浦发信用卡消费满额分期最高可享2期手续费减免。网银、微信、手机银行办理更便捷！请详询官网。回复TD退订,0,,
一次天热和朋友在一咖啡馆避暑打牌，听到隔壁桌有三位小姑娘在聊天。一姑娘天真地问另外两位姑娘：“哎，我问问你们哦，炒米粉里的BT辣是什么辣啊？”另外两位姑娘毫不犹豫的说：“变态辣！”发问的那位姑娘恍然大悟地说“哦！怪不得呢！我以为是不太辣。”,1,,
Carry on not disturbing both of you,0,,
When you guys planning on coming over?,0,,
企业如何创新营销模式，渠道与客户维护如何精耕细作？欢迎营销骨干走进清华董权教授讲《学仕特训营之营销实战》庄老师13348945077【交大】,1,,
乔丹中和店、银河店换季大甩卖，全场商品59元起，4月13日至21日，莫失良机！望新老会员前来选购，电话:8450707/8470707,1,,
应该问题不大,0,,
Thank you princess! You are so sexy...,0,,
Aiyar hard 2 type. U later free then tell me then i call n scold n tell u.,0,,
招商银行大众版网上支付验证码：465148。支付金额95.00元。请勿将验证码告知他人并确认支付网址为合法的招商银行网址！[招商银行],0,,
温馨提醒：户：蔡雪棉，开户：农行莘塍行，号：6228490330014513112，金额：5万元，您生活快！,1,A,温馨提醒：户名：蔡雪棉，开户行：农行莘塍支行，帐号：6228490330014513112，金额：5万元，祝您生活愉快！
中国优秀旅游城市漳州欢迎您！查询预订住宿餐饮、飞机、火车、汽车票拨打12580，查询旅游资讯登录官网www.zzta.com【漳州市旅游局】,1,,
8元数据流量加油包：8.00元,0,,
I wish! I don't think its gonna snow that much. But it will be more than those flurries we usually get that melt before they hit the ground. Eek! We haven't had snow since &lt;#&gt; before I was even born!,0,,
Haf u found him? I feel so stupid da v cam was working.,0,,
Hello. We need som|e po*sh bi^r*d~|s and chaps to u_ser~ _~trial prods for #champneys. Ca#n i put you~ down? I| need yo*ur address a_nd do~b asap~_. Ta #r,1,B,Hello. We need some posh birds and chaps to user trial prods for champneys. Can i put you down? I need your address and dob asap. Ta r
结婚娶亲本是一件高兴事，新郎却因一辆加长林肯车而当场落泪！这是为什么？详情请点击 http://10006.co/lbJ5,1,,
I'm on my way home. Went to change batt 4 my watch then go shop a bit lor.,0,,
即日起至2015年6月30日，工银环球旅行卡持卡人购买英国航空往返英国、欧洲机票，可享受商务舱、高级经济舱票价优惠10％，经济舱票价优惠5%！登录http://t.cn/Rhy2nKa、输入代码：ICBC即享。9月26日前至http://t.cn/Rhy6ko9预订年内Hertz全球门店（大陆除外）租车还可享最高6.7折优惠。预订时，在CDP处输入代码：999901。工银信用卡【工商银行】,0,,
(承上)至海外單筆3仟享1%刷卡金(上限1仟)於日本刷JCB卡累積1萬加碼350元，皆需登錄。謹慎理財信用無價循環利率6.73~19.98%,1,,
37万大三房，宽尺，不憋屈！【宝·塞纳际】开盘倒计时：优高至92折！2号双铁业/舒阔楼间距/典户型演绎/ 87633888,1,A,37万起大三房，宽尺度，不憋屈！【晶宝·塞纳国际】开盘倒计时：优惠高至92折！2号线双铁物业/舒阔楼间距/经典户型演绎/ 87633888
匯豐: 代理人新股認購服務 -萬都中國: 2013年5月20日至5月23日上午9時。查詢 22692121,1,,
中/国建^行携唯信易贷推出信用贷*款，无需任何抵押~，无需担保，额度1-1_00万，最快1天/放款。闫_经理1/8628393020【唯信易*贷】,1,B,中国建行携唯信易贷推出信用贷款，无需任何抵押，无需担保，额度1-100万，最快1天放款。闫经理18628393020【唯信易贷】
You can donate å£2.50 to UNICEF's Asian Tsunami disaster support fund by texting DONATE to 864233. å£2.50 will be added to your next bill,1,,
"今天带学员入(300223北京君正)明日拉绝对精彩,关注勿追!合作双赢才是硬道理!预约明日午盘布入内线0752-8465348【广盛机构】",1,,
"Hi there, 2nights ur lucky night! Uve been invited 2 XCHAT, the Uks wildest chat! Txt CHAT to 86688 now! 150p/MsgrcvdHG/Suite342/2Lands/Row/W1J6HL LDN 18yrs",1,,
【联通飞影】对美女自作情的果… http://fql.cc/pub/view/iid-48305,1,A,【联通飞影】对美女自作多情的后果… http://fql.cc/pub/view/iid-48305
When are you going to ride your bike?,0,,
温馨提示，截止7月31日24时，您当月套餐内流量已使用289.55MB，剩余流量10.45MB。登录 wap.10010.com 直充话费，方便又打折!,0,,
Only once then after ill obey all yours.,0,,
So wat's da decision?,0,,
"Call 090_94100151 to# use~ ur mins! C._alls ca~st 1~0p#/min (m*ob vary). Servic*e_ #pro**vided |by AOM, just GB|P5/month./ AOM Bo^x61,|M60 1ER_ _until u stop. Ages 18+^ only!",1,B,"Call 09094100151 to use ur mins! Calls cast 10p/min (mob vary). Service provided by AOM, just GBP5/month. AOM Box61,M60 1ER until u stop. Ages 18+ only!"
此前未有，此后更无！#城南CBD别墅，3#4_7-4^15㎡，周末邀您品鉴顶级豪车^|，上|万大奖恭候尊驾！【天合凯旋南城】13*056665558^,1,B,此前未有，此后更无！城南CBD别墅，347-415㎡，周末邀您品鉴顶级豪车，上万大奖恭候尊驾！【天合凯旋南城】13056665558
你好！本公司可代开各种税票（用票后付款）需要请联系：13967898093刘先生,1,,
全国独家妇乐糖浆：经典妇科用药，医生认知度高，空间好，上量快！费用支持开发医院，招湖北省、市代理商！13924000081杜经理【惠和药业】,1,,
出海航行:你想打就打呗。我晚上才打吧,1,,
房产汽车抵押贷款，注册资金增资垫资，企业个人过桥转贷，信用卡还款，代办银行贷款，利息低，出款快，闲钱托管！8876899【万泰投资】,1,,
"（接上条）立即回复#FQ#580651即可将您此笔1,210.00元交易分6期偿还，每期本金201.66元，每期手续费9.08元。[招商银行]",0,,
欧文，我是华涛，我周一估计要请一天假了，现在在天津，我大伯打电话说我大娘得了脑瘤，他们在天津做生意，我到天津看望一下他们。工作上分组功能bug都处理了，我周一晚上回北京，不影响周二发版,0,,
红树叶乐部隆重出客户，键下到手机，精无限，好礼连连。点击网址一键下:http://t.cn/zTM8cuh 【红树叶乐部】,1,A,红树叶俱乐部隆重推出客户端，一键下载到手机，精彩无限，好礼连连。点击网址一键下载:http://t.cn/zTM8cuh 【红树叶俱乐部】
纸袋碰腿北京2孕妇地铁内互殴[人民]-中国移动冲浪助手:http://go.10086.cn/nd/mgV/MYOpO,1,,
黄金结束七连阴昨夜迎来反弹，中国GDP下调增速至7.7，资金集体观望美国数据，伯南克对QE持续性、退出时机的讲话将决定黄金中期基本面走势，今日招财投资金条291元/克，招财猫金条299.9元/克，详询营业部85495878[招商银行],1,,
精彩免费软件推荐：“天翼视讯”，手机可以看影视、看动画，CCTV直播、NBA赛事直播，随时随地收看，精彩由您做主，下载地址http://180.3gbc.cn/?a=125621,1,,
六号线首站，低价大盘#，首付~19万，83平两|居，|不限购|，纯板楼，70年大产权，/百步即享百亿城市配套，.4*00|6562316.,1,B,六号线首站，低价大盘，首付19万，83平两居，不限购，纯板楼，70年大产权，百步即享百亿城市配套，4006562316.
"买房重品质!离石[水岸颐园]配置冷/暖/新风/24小时热水系统,室内四季如春。享受节能健康生活。准现/房热/线2292111/333【今音】",1,,
After completed degree. There is no use in joining finance.,0,,
刘畅:好，那咱俩周一早上同一班,0,,
乐蜂520聚划算品牌团，20款明星产品3折起！特送上VIP专享20元现金劵，520等您来~ t.cn/StzxnI【乐蜂网官方旗舰店】,1,,
最佳购房时机！两户即团购！优享85折，80余平小“三房”最大15平附送，78平两房超爽35万起，周末到访抽千元大礼6784888【天誉城】,1,,
财富早间版：央行例会货币政策表述未变，分析称暗示暂无降准必要；管理层稳增长立足深化改革措施。近期市场始终缺乏成交量整体弱势明显，进取投资者可适当关注国企改革、铁路、城镇化等结构性机会，稳健者仍应控制仓位、保持谨慎观望。投资建议仅供参考。【招商证券】,0,,
360安全中心：732898是您本次身份校验码，30分钟内有效，360工作人员绝不会向您索取此校验码，切勿告知他人。[360],0,,
专家呼吁增设春夏小长假[新浪]-中国移动冲浪助手:http://go.10086.cn/nd/meJ/GInMV,1,,
您尾号7544卡9日15:21网上银行支出(消费)5.70元。【工商银行】,0,,
"And that's fine, I got enough bud to last most of the night at least",0,,
您尾号7544卡27日20:17网上银行支出(消费)48元。【工商银行】,0,,
距繁华很近离尘霾很远【绿地·古根海姆山庄】京东海拔450米准现房半山独栋，独享3亩私属庄园，绝版30席传世大宅4006791112,1,,
No break time one... How... I come out n get my stuff fr Ì_?,0,,
【招商证券】财富收盘版：如近日提示指数出现具备一定力度技术性反弹，早盘提示券商股表现强劲，在控制仓位的前提下可继续持有或逢低吸纳。仅供参考。,0,,
"【招商银行】【招行北京金卡秘书】下载手机银行,首次登陆下载有礼""输入012789邀请码",0,,
;-) ok. I feel like john lennon.,0,,
"请您验证938h.com海通证 券早盘带领客户14.80元介入的300223。明日将获 利8以上,电021-29079513",1,,
百元入团享千人团购特惠！6月1日，建业壹号城邦至尊团购会惊爆开团！首届零距离恐龙科普展同步展映，到访抽ipad：5190000【房产咨询】,1,,
Ok i've sent u da latest version of da project.,0,,
尊/敬的球友，我.司专业办理成都各/球场_二手会籍^#，现有牧马山，~观岭，青#城山有意向咨询小渔1388098727/7【鴻阳高尔夫】【兴隆百货】,1,B,尊敬的球友，我司专业办理成都各球场二手会籍，现有牧马山，观岭，青城山有意向咨询小渔13880987277【鴻阳高尔夫】【兴隆百货】
美媒曝光中国地下空军:不可战胜[搜狐]-中国移动冲浪助手:http://go.10086.cn/nd/mgJ/jqaVi,1,,
"母亲节起源美国,为每年5月第2个星期日。想将历史上今天发生的重大历史事件设为手机炫铃吗?拨1015601按5试听下载!3元包月,内容天天新鲜",1,,
For taking part in our mobile survey yesterday! You can now have 500 texts 2 use however you wish. 2 get txts just send TXT to 80160 T&C www.txt43.com 1.50p,1,,
好的，多谢。,0,,
老……老好想你呀？你怎么老关着机呢？,1,A,老婆……老公好想你呀？你怎么老是关着机呢？
中山路，桂林心，首席城市综合体，23日上午9时兴达·城市广场世界品牌电梯零距离体验，赏文艺、品水果、精美礼品等您来拿，询3962836,1,,
Talk to g and x about that,0,,
