text,label,attack_type,original_text
上联：健康是天，健康是地，有了健康顶天立地。下联：朋友是风，朋友是雨，有了朋友呼风唤雨。横批：健康+朋友=天地人和！,0,,
您好！截至到2014年09月05日14时30分，您定制的（1）预存返话费捆绑10元流量包，数据流量剩余49.15MB，本地移动数据流量剩余16.43MB，（2）全球通套餐专属短信包，短信剩余114条，（3）全球通88商旅套餐，语音剩余270分钟，数据流量剩余30.0MB，感谢您的使用。中国移动,0,,
"今天带学员以15.55元左右买入《300223北京君正》明天早盘有望大涨,请关注勿追买!咨询电话18070269498【金丰投资】",1,,
美媒曝光^中国#地下空军:不可^战胜_[搜|狐_]-中国移动冲浪助手:http://go.#*10086.cn/nd^/mgp/12OkUA,1,B,美媒曝光中国地下空军:不可战胜[搜狐]-中国移动冲浪助手:http://go.10086.cn/nd/mgp/12OkUA
In da car park ,0,,
九牧王贵宾您好：今天公司为二七路店整合了1000多件夏季特价商品，款式新颖，价位最低，欲购从速，商品正在递减中，66226961【九牧王】,1,,
海南6名小学女生被校长带走开房[新华]-中国移动冲浪助手:http://go.10086.cn/nd/m3Z/FVRS6,1,,
"Its ok, called mom instead have fun",0,,
"Cool, want me to go to kappa or should I meet you outside mu",0,,
您好！您已成功办理15元数据流量加油包，含110MB国内移动数据流量（不含港澳台漫游），超出部分按原有资费标准执行，加油包立即生效，流量当月有效，月末最后一天24:00自动失效，此加油包每个月可最多订购10次，流量累加使用。北京移动推出本地闲时流量套餐，回复KTLLXS5办理，当月生效，每月5元可享1GB本地闲时流量（闲时时段：23:00至次日7:00，含2/3/4G网络）。中国移动,0,,
Gam gone after outstanding innings.,0,,
Depends on where u going lor.,0,,
吃饭。喝茶。逛街,1,,
Uncle Abbey! Happy New Year. Abiola,0,,
Men like shorter ladies. Gaze up into his eyes.,0,,
You also didnt get na hi hi hi hi hi,0,,
网上充值服务提醒：13811382650已通过中国移动北京公司网上营业厅（www.bj.10086.cn）成功充值话费30.0元。官网充值9.92折优惠火热进行中，感谢您的使用！,0,,
温馨提示：本公司长期代开正规发票，点数优惠，欢迎来电咨询合作。13613058085沈经理QQ：1786122873,1,,
逛山庄外庙，揽长城精粹，游坝上草原，看康熙大典，赏帝苑梦华，浴森林温泉。承德旅游局提醒您选择正规旅行社，旅游咨询热线0314-2051023,1,,
【去哪儿网】2014-08-03，深圳宝安机场T3到北京南苑机场的KN5856航班（15:25起飞/18:25到达）已出票。姜燕北票号781-5277205440。请提前2小时到机场办理乘机手续。蜀蓉商旅网，唯一客服电话：010-89678724。此票退票只退机建和燃油，不可改签，详情请点击http://d.qunar.com/OVf_Bv 。,0,,
东北菜_好吃又.实在！东北人美食龙虾上市啦！惊爆价每斤25另|推特*价排骨锅39（三斤排*骨）13~962700444【~泰宁桥药房对面|中国银行^^西一百米】,1,B,东北菜好吃又实在！东北人美食龙虾上市啦！惊爆价每斤25另推特价排骨锅39（三斤排骨）13962700444【泰宁桥药房对面中国银行西一百米】
尊敬的客户：车险增*值服务卡网上平台开通啦！汽车配件、酒水食品、电子电器、旅游养生！赶快登陆qianwei.ormita.cn！,1,,
总价53万入住北戴河中心唯一在售4层电梯洋房【戴河林语】，藏山揽海名居，观鸟湿地西1.5千米，赠送下跃阁楼，成熟配套准现房发售4283888,1,,
您是猜数高手吗？每月18－20日期间，回复1-999999之间的整数即可参与“猜小数-有奖”活动。活动期间您发送的整数是最小且唯一的，将获1000元现金大奖！回复整数马上参与吧！,1,,
Want explicit SEX in 30 secs? Ring 02073162414 now! Costs 20p/min,1,,
贵账户1407于06月06日23:59发生直付通/快捷支付扣款，金额人民币32.99，详询95555[招商银行],0,,
Did you get any gift? This year i didnt get anything. So bad,0,,
【腾讯科技】此验证码只用于登录你的微信或更换绑定，验证码提供给他人将导致微信被盗。760000（微信验证码）。再次提醒，请勿转发,0,,
No. Did you multimedia message them or e-mail?,0,,
中部500强总部基地，金水东路/新省府旁【雅宝东方国际广场】开盘在即，多家知名企业抢先进驻，86折特惠仅限本周61275555/6666,1,,
贺昨建【时代万恒】现已拉停板，说到做到，今日指导学员建【天地源】该股将成为明日之星，请全国散户共同见证！热线4006547800【南易基金】,1,,
Ok... Ur typical reply...,0,,
【德克士太百餐厅】凭此短信在德克士（太百餐厅）享受正价单品8折优惠，更有多款专属套餐超低折扣！【地址】阿克苏市新华东路33-1号太百购物中心一楼【电话】0997-2222888,1,,
淋漓的夏日，无线音乐给你带来无限的欢“乐”时光！活动期间发送SJTJ到10086首次开通咪咕特级会员1元升级包且在次月15日前不退订，即可获得2元话费和一次Ipad4等大礼抽奖机会哦！活动ing: http://139url.cn/9gjqpj,1,,
"美国顶级木业项目，州政府千万美元补贴，就业盈余率超高。一人办理全家绿卡,无须居住,周六14点环球188，询4000851851【外联】",1,,
Pls what's the full name of joke's school cos fees in university of florida seem to actually be  &lt;#&gt; k. Pls holla back,0,,
Well. Im computerless. Time to make some oreo truffles,0,,
"【南方基金】国家政策的扶持、老龄化及人们对健康生活的需求日益增强使得医药行业具备长期投资价值。南方500医药ETF（512303），完全复制中证500医药卫生指数，该指数成立以来年化收益27.45％, 同期沪指年化收益6.62％（2004.12.31-2014.9.9，万得数据），10月9日-30日各大券商有售，投资健康，分享成长！询4008898899，谨慎投资，回QXYX退订",0,,
"您尾号7544卡17日15:43工商银行收入6,272元。【工商银行】",0,,
FREE camera phones with linerental from 4.49/month with 750 cross ntwk mins. 1/2 price txt bundle deals also avble. Call 08001950382 or call2optout/J MF,1,,
Still otside le..u come 2morrow maga..,0,,
"Just sent again. Do you scream and moan in bed, princess?",0,,
您账户4371于10月03日18:06ATM取款人民币3000.00。微信无卡取款立享便捷:t.cn/8sKVdxN。[招商银行],0,,
Ya even those cookies have jelly on them,0,,
您尾号4118的信用卡27日13:54消费人民币436.00元。送你99积分，马上领 t.cn/8s52qAr 。[招商银行],0,,
用歌声来传递心情吧!<今生无缘来*#生再聚><愿得一*人心><风吹麦~浪/><流恋>马上拨打10157*88诸多~炫铃等.着您_!0.4元/分,1,B,用歌声来传递心情吧!<今生无缘来生再聚><愿得一人心><风吹麦浪><流恋>马上拨打1015788诸多炫铃等着您!0.4元/分
"Ok., is any problem to u frm him? Wats matter?",0,,
你*好#，建行推出个人与企业~信誉贷5-200万，无需担~~保，放款前无费用#，需求者请联系|：|1515011*3873李经理,1,B,你好，建行推出个人与企业信誉贷5-200万，无需担~保，放款前无费用，需求者请联系：15150113873李经理
[PUSH]河南信阳-您的好友发来照片信息，请查收！,1,,
最具潜力楼盘【恒大花园】南北通透户型，紧邻铁路局商圈高铁新区，交通便利，高层多层商铺同期销售中，期待您光临！询3762999【信使】,1,,
Draw va?i dont think so:),0,,
睡了吧，开车刚回来,1,,
26th OF JULY,0,,
东南四环地铁旁6-9层洋|房，一梯两户3.1米层高，108-135双卫三居，金卡2万优|惠4006117178【葛洲坝紫郡府】,1,,
尊敬的聚成学员：下午好！为什么有的员工积极性不高，做事十分欠主动？为什么有的员工素质太差，经常得罪客户、损失营业额、破坏公司形象？为什么有的员工跳槽事件不断，企业成为竞争对手的人才输送基地？要想有不一样的结果，首先要有不一样的行动！！欢迎走进5月25日《为自己工作—做最好的员工》讲堂！参课地址：重庆市江北区金源路64号(君豪大酒店)对面工商大学隔壁--江北艺术文化中心【聚成股份】,1,,
Hey... are you going to quit soon? Xuhui and i working till end of the month ,0,,
【财付通】983259(微信验证码，请勿泄露)，您于2014-09-02 13:20:15使用微信零钱发起交易61.00元,0,,
You know there is. I shall speak to you in  &lt;#&gt;  minutes then,0,,
内幕消息：今天公布私幕巨资拉升股票【中远航运 600428】详情请登陆www.336569.com 查看【中银国际】,1,,
You busy or can I come by at some point and figure out what we're doing tomorrow,0,,
\SHIT BABE.. THASA BIT MESSED UP.YEH,0,,
关爱健康，绿色办公，远离空调病。万国城MOMA 长风中央9号，长风街、新晋祠路金三角，CBD门户恒温恒湿写字楼6078000【A】,1,,
【中海紫御公馆】96㎡舒适两居，141㎡“3+1”多变空间，最后一栋，即将推售4978888,1,,
模块咯美克美家,0,,
兄弟姐妹们，我于2013。5。25号结婚，有空的朋友们要来喝喜酒。,1,,
龙心俱乐部探寻中国文化生命基因系列讲座第二讲“道家内丹——中国文化的生命智慧之学”，5月25日周六下午2:30至5:30，中国老 子道学研究会会长胡孚琛先生，用现代科学、哲学、心理学破译内丹学穷理尽性以至于命的道理法术。咨询18601391410王浩轩,1,,
您好，目前北京移动可提供多种充值缴费方式，您可以通过购买充值卡拨打13800138000，到营业厅交纳话费或预存，也可通过北京移动网站进行网上充值（随e行暂不支持）或购买充值卡。感谢您的使用！,0,,
【猎聘网】猎聘秘书台:17:13与您通话的是猎头段建引(ID号:LT1528109)可登录网站查询联系.请您回复短信对此次通话进行评价，1为满意，2为一般，3为不满意。,0,,
Ok no prob. Take ur time.,0,,
Please CALL 08712402779 immediately as there is an urgent message waiting for you,1,,
"Usf I guess, might as well take 1 car",0,,
"您尾号2650的明珠卡新增乘机记录：2013-07-08乘坐的CZ612W大连-北京W舱，累积奖励里程550公里、升级里程550公里、升级航段1个。目前可使用里程合计1750公里,2013年度升级里程550公里、升级航段1个。如有疑问请致电95539【南航】",0,,
今建【600665天地源】明必漲6！我司做庄控股，今买明卖，稳定收益！切勿错失赚钱最佳良机，牛 股建仓电4006330658【广福基金】,1,,
请关注【600665天地源】今5月16日开盘巨资拉升，必涨;我方资金已提前介入，勿追！索取更多质变股。加入QQ号：869267826,1,,
Lol that's different. I don't go trying to find every real life photo you ever took.,0,,
美媒曝光中国地下空军:不可战胜[搜狐]-中国移动冲浪助手:http://go.10086.cn/nd/mgv/NbAFI,1,,
财富收盘版：指数维持强势震荡格局，个股行情持续活跃较好的维持了市场赚钱效应，故即使回调向下空间亦有限。投资建议仅供参考。【招商证券】,0,,
No he didn't. Spring is coming early yay!,0,,
【五一钜】中铁皇半岛82～135平刚需，最赠7万享3重礼助安家，购房获Iphone5、Ipad、数相机等7501111【中铁】,1,A,【五一钜惠】中铁秦皇半岛82～135平刚需婚房，最高赠7万享3重礼助您安家，购房获Iphone5、Ipad、数码相机等7501111【中铁】
"您尾号7544卡8日13:21网上银行支出(消费)1,000元。【工商银行】",0,,
~我也休息,1,B,我也休息
I HAVE A DATE ON SUNDAY WITH WILL!!,0,,
【支付宝】jia**@h*.*，付款成功。本交易获得5元购物补贴，24小时内登录支付宝钱包 m.alipay.com/J/c5940 领取,0,,
"套餐余量提醒服务：截至本月25日,您定制的(1)20元终端特惠套餐包包含的数据流量剩余0.00MB;(2)40元400M数据流量套餐(4G)包含的数据流量剩余604.19MB;(3)58元300分钟语音套餐(4G)包含的语音剩余83分钟;感谢您的使用。查流量、查话费、办业务、优惠早知道！就用“北京移动”手机客户端。点击下载： http://mobilebj.cn/?c=126 中国移动。",0,,
Da is good good player.why he is unsold.,0,,
"Arngd marriage is while u r walkin unfortuntly a snake bites u. bt love marriage is dancing in frnt of d snake &amp; sayin Bite me, bite me.",0,,
想短时间/内/学好外^语还/得请老^_外，月均一千八，一教^一授课*，纯英文*|浸泡式语境提高外语^立竿见影！免-费试学询：666/3*0286【英语资讯】,1,B,想短时间内学好外^语还得请老^外，月均一千八，一教^一授课，纯英文浸泡式语境提高外语立竿见影！免-费试学询：66630286【英语资讯】
温馨提示，截止3月31日24时，您当月套餐内流量已使用280.38MB，剩余流量19.62MB。登录 wap.10010.com 直充话费，方便又打折!,0,,
美媒曝光中国地下空军:不战胜[搜狐]-国移动冲助:http://go.10086.cn/nd/mgp/117TIi,1,A,美媒曝光中国地下空军:不可战胜[搜狐]-中国移动冲浪助手:http://go.10086.cn/nd/mgp/117TIi
尊敬的客户，您于今日19点19分在中国移动北京公司网站进行了套餐资源查询，特此提醒。网上营业厅致力于为您提供“十分满意”的服务。,0,,
"天猫免费体验节：动动手指就能免费获取49元品牌礼品一份,数量有限，详情加QQ群：321674877【麦贝科技】",1,,
""" 全新开通各家银行联保信用贷款、不限行业、额度充足、年息8.4、7天放款、单户最高500万、潘经理:13311221776、..",1,,
"Just wondering, the others just took off",0,,
"""截止到2014年03月25日，您的帐户当月可用余额为66.00元。",0,,
"【一触即发】：猜指数赢固定收益，明日发售网上购买，无参与退出费，5万起点，猜对看涨3个月（年化6.2），6个月（6.4);看跌3个月（6.6),6个月（6.8）；猜错也可获收益0.2。详询您的客服或68418114.－招商京车公庄【招商证券】",1,,
DHC周二秒杀：樱桃果明套装劲爆55折，限量抢购！王牌卸妆油、防晒乳超低价最后24小时！详询官网或4008208820【蝶翠诗】,1,,
昨提示大盘蓄势待发，今就放量上涨，这就是能力！赶紧加入操盘手实盘指导群：16266747，把握起涨机会，更有明日盘前潜力股推荐 【益盟操盘手】,1,,
还没看上房子呢？别比啦，偶寓，2900元/平，精装送家电好实惠；公园边政/府旁邻内大学区房；全复式+5.4客厅挑高最敞亮！询：3395888,1,,
【南航】您尾号为2650的南航明珠卡号于06-25 09:54登录明珠网站。若非您本人或授权操作，为确保帐户安全，请及时致电95539,0,,
您的项目我的资源，合作方式多样化，解决企业难题，优质项目优先。苏经理13391608091【东方顾问】,1,,
好地段好房子、福瑞家园送好礼。到访即抽夏凉被，购房100中家电大奖，电视、冰箱、洗衣机等您拿，100-130㎡精品准现房【4265777】,1,,
有房产/轿车急用钱？短期借款当日放，银行贷款5日批贷/有房款可按7成至满成二次贷款。热线010-51291888,1,,
I think asking for a gym is the excuse for lazy people. I jog.,0,,
您好！您已成功对您的点数帐户进行充值游戏点数10花费0.1元人民币。中国移动。,0,,
女护士乘电梯被夹死事故原因查明[腾讯]-中国移动冲浪助手:http://go.10086.cn/nd/mcP/7tgWV,1,,
Boo what time u get out? U were supposed to take me shopping today. :(,0,,
She doesnt need any test.,0,,
企##业如何创新营/销模式，渠道*与客户维护如何精耕细作？欢迎营销/骨干走/进_/清华.董权教授讲《学仕特训营之营销实战》庄老师1334894|5077【交大】,1,B,企业如何创新营销模式，渠道与客户维护如何精耕细作？欢迎营销骨干走进清华董权教授讲《学仕特训营之营销实战》庄老师13348945077【交大】
Yes da. Any plm at ur office,0,,
"""您输入的命令格式不正确，正确的格式是：1请回复序号：",0,,
确认,0,,
I dont understand your message.,0,,
"2800含税泰国柬埔寨8日6晚超值游,5月30、31,6月2、4、5、7日发团,详询02162523276/62518930 【春秋】",1,,
"\EY! CALM DOWNON THEACUSATIONS.. ITXT U COS IWANA KNOW WOTU R DOIN AT THEW/END... HAVENTCN U IN AGES..RING ME IF UR UP4 NETHING SAT.LOVE J XXX.\""""",0,,
"What are you doing in langport? Sorry, but I'll probably be in bed by 9pm. It sucks being ill at xmas! When do you and go2sri lanka? ",0,,
"Sorry, I'll call later in meeting any thing related to trade please call Arul. &lt;#&gt; ",0,,
A股双向交易平台可买涨、买跌当天随时买进卖出，获利提速，资金杠杆100倍，入金即送5％！登录www.93589.com【鑫金融】,1,,
真恐怖！孕妇乘飞机晕机呕吐，结果吐出来的东西令人出乎意料！详情点击http://wap.189hz.com/r/QnIv6z,1,,
Yup song bro. No creative. Neva test quality. He said check review online.,0,,
"同质产品,同样业绩,收入倍增且保证续期利益.详询15080464775李总或直接回复.如有打扰敬请谅解【祥天保险】",1,,
6900元/㎡即享北市月牙塘片区双学校生态美宅，意向认筹火热进行中，售楼地址：龙泉路昆八中北侧63624888,1,,
"有一种快乐漂漂洒洒,有一种自在平平淡淡,有一种幸福安安静静,有一种拥有实实在在,有一种友谊长长久久,有一个我天天祝福你!【今天（10日）11:00-15:00转该短信给10位以上广东移动好友，按时间排名前20名会员即奖励100元优惠积分。详询回复3 广州移动】",1,,
【快的打车】粗大事啦~为庆祝「快的打车」市场占有率近6成，稳居打车APP第一，土豪老板决定给所有快的用户每人送一张6元代金券！快来瞅瞅~,0,,
S s..first time..dhoni rocks...,0,,
"153091(微信支付验证码,请勿泄露),您于20:31使用尾号7544的中国工商银行卡发起交易299.10元【财付通】",0,,
For real when u getting on yo? I only need 2 more tickets and one more jacket and I'm done. I already used all my multis.,0,,
尊敬的用户您好，本次支付验证码为067092。请在页面提交验证码完成本次购买。,0,,
纸袋碰腿北京2孕地铁内互殴[人民]-中国冲浪助:http://go.10086.cn/nd/mgR/U2Osx,1,A,纸袋碰腿北京2孕妇地铁内互殴[人民]-中国移动冲浪助手:http://go.10086.cn/nd/mgR/U2Osx
M假如的伙伴，如果你再近需要*钱、我们竭城为你解忧，年１５，免担*保，联系：(1528一6828一808)魏先生,1,,
"""截止当前，您的WCDMA(3G)-66元套餐套餐包外资费A的3G语音50分钟,已使用19分钟,剩余31分钟;3G套餐内流量307200KB,已使用250287KB,剩余56913KB;国内短信240条,已使用0条,剩余240条;可视电话10分钟,已使用0分钟,剩余10分钟;M值6M,已使用0M,剩余6M;T值10T,已使用0T,剩余10T;通信费用请以帐详单为准。",0,,
内环地口复式商住楼，主面积65平，复式结构成两层，200万买一套，投资自用两相！非华！冯杰15800518243【德佑】,1,A,内环地铁口复式商住楼，主力面积65平，复式结构已隔成两层，200万买一套，投资自用两相宜！非常繁华！冯永杰15800518243【德佑】
What can i do? Might accidant tookplace between somewhere ghodbandar rd. Traffic moves slovely. So plz slip &amp; don't worry.,0,,
您好！由于系统错误，请您稍后重新操作。充值、购机、查询话费、办业务就上www.10086.cn，官网充值便捷安全，更有超值折扣优惠。中国移动,0,,
\Hey j! r u feeling any better,0,,
下应用，下游戏，哪里去？搜狗市场来帮你，最全面的应用平台，最火爆的游戏推荐，搜狗应用市场，让你的掌上生活更精彩。下载地址： http://220.178.26.158:8080/sta?id=00016,1,,
《威固隔热膜》欧洲名车厂定隔配，无伦比的隔能，给你前所未有的舒感受。在6月30日贴有多重大等你拿《车公主》2297169,1,A,《威固隔热膜》欧洲名车原厂指定隔热配置，无以伦比的隔热性能，给你前所未有的舒适感受。在6月30日前贴有多重大礼等你拿《车公主》2297169
(2/2)d.gjdx.cc 上自行修改短信内容，用户名为您的固话号码，密码为您手机号码后6位，咨询热线：4006066676,1,,
清明，让这个春天更温情。怀着一份思念，追忆一丝缅怀，释放一种心绪，传递一份祝福，祈祷一生平安，愿收到短信的你快乐幸福、家人平安。,0,,
姜燕北先生，我行将调升您信用卡固定额度至50000元，如不愿接受此服务，可在2014年11月01日21点前回#TGEN表示拒绝。巧用额度理财，猛戳 t.cn/8Fdn3VH 查询[招商银行],0,,
美媒曝光中国地下空军:不可战胜[搜狐]-中国移动冲浪助手:http://go.10086.cn/nd/mgp/10BFUq,1,,
我的照片，你看得见，“拍秀”，就是这么简单令人心动的时尚手机拍照记录社区，快来下载吧!下载地址（http://t.cn/zT1QwzT）,1,,
Ur cash-balance is currently 500 pounds - to maximize ur cash-in now send GO to 86688 only 150p/msg. CC: 08718720201 PO BOX 114/14 TCR/W1,1,,
Should i send you naughty pix? :),0,,
纸袋碰腿北京2孕妇地铁内互殴[人民]-中国移动冲浪助手:http://go.10086.cn/nd/mha/O4ynn,1,,
美媒曝国地下空:不可战胜[搜狐]-中国移动冲助手:http://go.10086.cn/nd/mgp/16Xm2M,1,A,美媒曝光中国地下空军:不可战胜[搜狐]-中国移动冲浪助手:http://go.10086.cn/nd/mgp/16Xm2M
So that takes away some money worries,0,,
"""截止当前，您的WCDMA(3G)-66元套餐套餐包外资费A的3G语音50分钟,已使用19分钟,剩余31分钟;3G套餐内流量307200KB,已使用261480KB,剩余45720KB;国内短信240条,已使用0条,剩余240条;可视电话10分钟,已使用0分钟,剩余10分钟;M值6M,已使用0M,剩余6M;T值10T,已使用0T,剩余10T;通信费用请以帐详单为准。",0,,
凯盛家纺4月28日厂家千万库存工厂价“0利润”直销，被子99元四件套100元起，先到先得。地址地税局对面3990317【绥芬河市凯盛家纺】,1,,
美媒曝光中国地下空军:不可战胜[搜狐]-中国移动冲浪助手:http://go.10086.cn/nd/mgI/7Ynnq,1,,
RECPT 1/3. You have ordered a Ringtone. Your order is being processed...,1,,
午盘带客户建【600641万业企业】明早必将拉升出局，请全国散户关注拉升情况勿追！明午建仓下档金股。提前建仓4006322658【金源财经】,1,,
Ofcourse I also upload some songs,0,,
还在担心骚扰_电话^*，^^隐私^泄漏_么？让“360手机^安全/卫士”为你保驾护航吧，~一键式安全扫描，手机加速，为您|带来全方位隐私保护_，让手机卸掉重担，~运转^如飞！亲，联通用户免流量费下载哟！下载地址：       http:/~/hao.hb1#/65.com/||i/1/IuabgEf8,1,B,还在担心骚扰电话，隐私泄漏么？让“360手机安全卫士”为你保驾护航吧，一键式安全扫描，手机加速，为您带来全方位隐私保护，让手机卸掉重担，运转如飞！亲，联通用户免流量费下载哟！下载地址：       http://hao.hb165.com/i/1/IuabgEf8
"双色球 第2014081期开奖号码:08,14,22,24,27,29:10。双色球自选回“S#投注号码*倍数”（投注号码为6个红球1个蓝球，多注用#隔开，最大为5注），回复HS获取更多双色球帮助信息。其他彩种帮助信息回复“H+彩种代码”，如回HD获取大乐透帮助信息。【中国移动和包彩票】",0,,
"see, i knew giving you a break a few times woul lead to you always wanting to miss curfew. I was gonna gibe you 'til one, but a MIDNIGHT movie is not gonna get out til after 2. You need to come home. You need to getsleep and, if anything, you need to b studdying ear training.",0,,
周六大型主题发布会：美国移民政策及风险规避。好莱坞《音乐之声》原型-百年特普家族携美国使馆官员及主流媒体诚邀光临。详询：4006169700,1,,
埔头大鸿电器5**.1促销29一2日大折4天空..调冰箱冷柜电.#视风扇5折起落地扇98元起全场_小|电4折起满20/0就送豪礼一份询85/508687【美的】,1,B,埔头大鸿电器5.1促销29一2日大折4天空调冰箱冷柜电视风扇5折起落地扇98元起全场小电4折起满200就送豪礼一份询85508687【美的】
《企业绩效考核、薪酬体系设计与劳动用工风险控制实战班》由著名人力资源专家5月23-25日于清华授课!电话010-82864689【开课通知】,1,,
WINNER! As a valued network customer you hvae been selected to receive a å£900 reward! To collect call 09061701444. Valid 24 hours only. ACL03530150PM,1,,
纸袋碰腿北京2孕妇地铁内互殴[人民]-中国移动冲浪助手:http://go.10086.cn/nd/mh1/TyoIK,1,,
【猎聘网】猎聘秘书台:09:28与您通话的是猎头张俊涛(ID号:LT11825913)可登录网站查询联系.请您回复短信对此次通话进行评价，1为满意，2为一般，3为不满意。,0,,
尊敬的13842892940用户：根据您上月话费额度，您可获得百元话费，请打1259083788领取！,1,,
Shall i come to get pickle,0,,
"For ur chance to win a å£250 cash every wk TXT: ACTION to 80608. T's&C's www.movietrivia.tv custcare 08712405022, 1x150p/wk.",1,,
Dont pick up d call when something important is There to tell. Hrishi,0,,
