text,label,attack_type,original_text
携手进口大众甲壳虫接您观影5月24-6月2日博纳会员提前一天订票有机会享受“虫子”免费TAXI服务.TEL：59775660【博纳悠唐影城】,1,,
成功红树林2期火热排号即将启幕！现到场即可免费办理VIP卡登记，凭卡开盘即享惊喜！一期安适两居加紧强推，机会不多，详询02882002600,1,,
您好！截至到2014年08月12日08时24分，您已使用数据流量341.77MB，其中套餐外流量341.77MB，已产生套餐外流量费用0.0元，套餐内剩余流量20.0MB，感谢您使用流量查询服务。中国移动,0,,
家长：中考28^天“短训”速提60分！名师1对1精讲数~理*化英“必考点、常考题/”掌握~高分技巧，^稳过^分#数线！询8*5833699【金牌】,1,B,家长：中考28天“短训”速提60分！名师1对1精讲数理化英“必考点、常考题”掌握高分技巧，稳过分数线！询85833699【金牌】
尊敬15993669267用户：根据您上话费额，您有机会得到百元话，请打1259083788领取！,1,A,尊敬的15993669267用户：根据您上月话费额度，您将有机会得到百元话费，请打1259083788领取！
【139邮箱登录安全提醒】欢迎您于08-13 10:08从电脑登录139邮箱，如非您本人登录，可回复SD锁定邮箱，回复X取消提醒。,0,,
"买房品质!石[水岸颐园]配冷/暖/风/24时热水系统,室内四季如春。享受节能健康。准现/房/线2292111/333【今音】",1,A,"买房重品质!离石[水岸颐园]配置冷/暖/新风/24小时热水系统,室内四季如春。享受节能健康生活。准现/房热/线2292111/333【今音】"
您好！截至到2014年09月06日14时40分，您已使用数据流量57.96MB，套餐内剩余流量92.05MB，其中：国内通用流量剩余79.15MB，本地流量剩余12.9MB，感谢您使用流量查询服务。中国移动,0,,
人生“三件事不能硬撑”：花钱、喝酒、看病；人生“三件事不能硬等”：孝老、行善、健身；人生“学说三句话”：算了、不要紧、会过去的！,0,,
Yes just finished watching days of our lives. I love it.,0,,
您好！截至到2014年09月18日23时51分，您定制的（1）预存返话费捆绑10元流量包，数据流量剩余0.0MB，本地移动数据流量剩余0.0MB，（2）全球通套餐专属短信包，短信剩余44条，（3）全球通88商旅套餐，语音剩余32分钟，数据流量剩余0.0MB，（4）15元数据流量加油包，数据流量剩余19.13MB，感谢您的使用。中国移动,0,,
"Ok, be careful ! Don't text and drive !",0,,
YES! The only place in town to meet exciting adult singles is now in the UK. Txt CHAT to 86688 now! 150p/Msg.,1,,
"尊敬的客户，您好！招行推出下载手机银行赢iPhone5s活动！下载地址 m.cmbchina.com 运行后点击下载有礼""凭账号、密码登录，输入抽奖码""100579""参与抽奖。活动期间可能会有我行工作人员致电为您提供安装服务[招商银行]""",0,,
Thanks for ve lovely wisheds. You rock,0,,
"My mobile number.pls sms ur mail id.convey regards to achan,amma.Rakhesh.Qatar",0,,
PPS: 823879 (00:18:20)PPS網上購物2013********2138金額$111.24查詢23119876,1,,
"您尾号7544卡1日12:22工商银行收入(李海溶)2,000元。【工商银行】",0,,
"嘉五芳斋盒/礼，官品，家安全认证，质量保证，价格优惠.免费送货上门,货到付款，欢迎咨400-881-0310【嘉兴五芳斋】",1,A,"嘉兴五芳斋礼盒/礼券，官方正品，国家食品安全认证，质量保证，价格优惠.免费送货上门,货到付款，欢迎咨询400-881-0310【嘉兴五芳斋】"
So u gonna get deus ex?,0,,
尊的用您好！天津有线带迎一亲情回馈，6M月最低60，10M最低72，截至日期5月30日，详询4006515006,1,A,尊敬的用户您好！天津有线宽带迎五一亲情回馈，6M月均最低60，10M月均最低72，截至日期5月30日，详询4006515006
每日一助：板桥镇板桥村有鱼塘30亩低价出租，可养鱼、小龙虾、甲鱼。联系人：林刚13758239280 .农民信箱\临安市联络支站(俞俊),1,,
"Good morning, im suffering from fever and dysentry ..will not be able to come to office today.",0,,
一直梦想走进，原来如此靠近。除远洋天著，五环边再无纯别墅。240平起，重磅加推全新联排、独创平墅，八中为邻4000621258 -[会员],1,,
Ok... Thanx... Gd nite 2 Ì_ too...,0,,
I'm reaching home in 5 min.,0,,
万仕6层“美大都汇”全新起，14万即可做恒商餐航母房！高回报，即即收益！抢富专线：7927777[商讯],1,A,万马仕6层“美食大都汇”全新起航，14万即可做恒大商圈餐饮航母房东！高回报，即买即收益！抢富专线：7927777[商讯]
"Nah it's straight, if you can just bring bud or drinks or something that's actually a little more useful than straight cash",0,,
和昌都汇广场携手大商集团共创商业奇迹，财富风暴席卷郑西，首批金铺4.20当日售罄，二批40-100平临街旺铺VIP会员招募63270999,1,,
Huh i cant thk of more oredi how many pages do we have?,0,,
That means from february to april i'll be getting a place to stay down there so i don't have to hustle back and forth during audition season as i have since my sister moved away from harlem.,0,,
"温.馨提^示：截止到20/13年05月2.0日，您当月套餐_内流量已使用80../00^MB，剩余流量~1024.00MB（如您订购~了红围脖或云雀^/流量叠加|包，则该包|内的剩|余流量包含^在剩余总流量内，请注意区分使用）。本次查询结果存在延时，请以出账为准。【买3G就上 10010.com】117.141.184.245,2013-05-21 02:44:15,type=_upload,imei=0f0b1a006f#~b6|434b9^4c#.b*9^3703^87a67^23&os=Android^^&version=1.10.~#0&src_name=pro/c_/cl~ear&fil*e/_url=/da|ta/360mobile/o~pi#nion/U_ploadFile*/2013052~1*/p#roc_c/lear~/An~dr^o^id/proc__cle.ar_0f~0b1a|/_00~6fb6434.b94cb9370387a#6723_13#69^075455645_2.txt",1,B,"温馨提示：截止到2013年05月20日，您当月套餐内流量已使用80.00MB，剩余流量1024.00MB（如您订购了红围脖或云雀流量叠加包，则该包内的剩余流量包含在剩余总流量内，请注意区分使用）。本次查询结果存在延时，请以出账为准。【买3G就上 10010.com】117.141.184.245,2013-05-21 02:44:15,type=upload,imei=0f0b1a006fb6434b94cb9370387a6723&os=Android&version=1.10.0&src_name=proc_clear&file_url=/data/360mobile/opinion/UploadFile/20130521/proc_clear/Android/proc_clear_0f0b1a006fb6434b94cb9370387a6723_1369075455645_2.txt"
Havent planning to buy later. I check already lido only got 530 show in e afternoon. U finish work already?,0,,
温馨提示：近日有打鼎盛汤经理名义诈骗的，请特别留意，我司不向任何客户借钱，汤经理电话无变动，我司山东省内只做货到付款，13964199297,1,,
5万88折限量预约！200－500平精品写字楼，中粮20万平商业配套，领世界500强，中 央别墅区核心4006888382【中粮祥云写字楼】,1,,
纸袋碰腿北京2孕妇地铁内互殴[人民]-中国移动冲浪助手:http://go.10086.cn/nd/mgR/TGHQE,1,,
Then dun wear jeans lor...,0,,
"贺上周五建仓600428中远航运,今天现已冲高7个点，请内部客户准备运行出仓.下午建仓专线4006477286 王老师【元通投 资】",1,,
Not tonight mate. Catching up on some sleep. This is my new number by the way. ,0,,
贵账户1407于02月16日11:46通过专业版转出人民币50000.00，手续费0.00，如疑请拨95555[招商银行],0,,
"Sounds gd... Haha... Can... Wah, u yan jiu so fast liao...",0,,
2marrow only. Wed at  &lt;#&gt;  to 2 aha.,0,,
【网银在线】您的京东白条（订单7091087589）还差2天就到最后付款日，请及时付款，以免逾期违约，如已付款无需理会。【白条】,0,,
王师傅，早上好，今天要装的柜子的迪拜胡小姐的柜子的柜号是BM0U4491970封锁00LBZR3139车牌粤BJ9593，15013835808,1,,
财富早间版：国务院正式批准设立中国上海自贸区；权威媒体称五大行上报大额同业存单方案利率市场化推进。指数受国内外利空因素制约短期缺乏上攻催化剂，预计继续回落整理可能性较大，仓重者应缩减仓位应对。投资建议仅供参考。【招商证券】,0,,
ÌÏ still attending da talks?,0,,
您尾号4118的信用卡08日13:30消费人民币436.00元。推荐办卡领1000积分 t.cn/8FPbRoz 。[招商银行],0,,
即买即收租金~上海市中心唯一带五百强和领事馆租约销售的5A甲级写字楼，租金11年回本，单价4万起！促销售楼18501600533【中山广场】,1,,
Whatsup there. Dont u want to sleep,0,,
All e best 4 ur driving tmr :-),0,,
A 只接收《满意100优惠资讯》,0,,
Many more happy returns of the day. I wish you happy birthday.,0,,
【友友租车】【跨年有你 友友有礼】特大喜讯：认识这么久，是该感谢您信任的时候了。双旦期间在固定时间内租车，立赠温泉票2张、电影票2张。手快有慢则无，点此 http://t.cn/Rz1g3Tc 还可以得200元代金券哦！,0,,
联通炫铃，让等待的声音更美妙！拨1015551立即开通炫铃，铃音选择和设置请登陆hn.10155.com，5元/月，详询10010。,1,,
北京爱迪国际学校，第一品牌国际学校全英文国际高中！百分百大学升学率！直升美英澳加名校！6月开始英语强化13910839443【MY数据】,1,,
快捷键哈哈哈,0,,
躺在客厅沙发，也能抚摸阳光！金阳|北绝版意式风情小*镇米兰春天_，阔~景三~房*#再次限量加推，成功认购可抽*取神秘大奖！米兰热线6#676^333【米兰春天】,1,B,躺在客厅沙发，也能抚摸阳光！金阳北绝版意式风情小镇米兰春天，阔景三房再次限量加推，成功认购可抽取神秘大奖！米兰热线6676333【米兰春天】
海淀与昌平交接处，210-650平米独栋别墅，本周特价180万/套起！70年产权，更有私家花园、露台赠送。热线: 56109000,1,,
Hey pple...$700 or $900 for 5 nights...Excellent location wif breakfast hamper!!!,0,,
新华快讯：浙江省高级人民法院今对张辉、张高平叔侄冤案作出国家赔偿决定，支付每人国家赔偿金110.57万元。详见 www.xhqm.cn,1,,
【支付宝】付款校验码228770，您正在使用支付宝付款100.00元。【请勿向任何人提供您收到的短信校验码】,0,,
aathi..where are you dear..,0,,
您尾号7544卡29日20:15网上银行支出(消费)23.15元。【工商银行】,0,,
PChome線上購物已接到您的訂單：20130521004277可至網站顧客中心查詢。提醒您： PChome不會以電話通知變更付款條件,1,,
University of southern california.,0,,
ÌÏ bot notes oredi... Cos i juz rem i got...,0,,
【浦发信用卡中心】好消息！邀请您参加“2015年新春奖”活动，将根据您2015/1/1至3/31期间的有积分消费总金额进行排名，前10万名即可通过关注并绑定“浦发银行信用卡中心”官方微信获得“新春大礼”！刷卡金丰厚诱人！赶快关注微信参加活动吧！详见官网！回复TD退订,0,,
I tot it's my group mate... Lucky i havent reply... Wat time do Ì_ need to leave... ,0,,
凯盛家4月28厂千万库工价“0利润”直销，被99四件套100元，先到先得。地址地税局对面3990317【绥芬河市凯盛纺】,1,A,凯盛家纺4月28日厂家千万库存工厂价“0利润”直销，被子99元四件套100元起，先到先得。地址地税局对面3990317【绥芬河市凯盛家纺】
团购二环边现房住宅，均价6000元每平，可正常贷款，配套高标准学校，开发商直销垂询热线：18787187126 （欢迎实地看房）【春城慧谷】,1,,
Dad says hurry the hell up,0,,
"急用钱，要融资怎么办？携手银行,为您解决资金难题：信用貸款，无低押，无擔保，月利1分1起。详询：13683436429袁经理【平安信贷】",1,,
"I.ll always be there, even if its just in spirit. I.ll get a bb soon. Just trying to be sure i need it.",0,,
"Hey babe! I saw you came online for a second and then you disappeared, what happened ?",0,,
"Alright we're hooked up, where you guys at",0,,
Your gonna be the death if me. I'm gonna leave a note that says its all robs fault. Avenge me.,0,,
Shall I bring us a bottle of wine to keep us amused? Only joking! IÛ÷ll bring one anyway,0,,
U wake up already? Thanx 4 e tau sar piah it's quite nice.,0,,
主城区最后的电梯洋房！【联城锦绣园】珍藏楼王， 78-147平低公摊尊宅， 2013当年入住！另有搜房超惠团购全城招募中！83717777,1,,
【猎聘网】猎聘秘书台:您22:04未接到猎头刘金山(ID号:LT1045800)的来电15012567807，您可回电或登录网站联系。,0,,
尊敬的客户：广发轮动基金认购期将于本周结束，根据经济周期、行业轮动策略进行合理配置。拟任明星基金经理朱纪刚，其所管理的广发核心今年增长31，有闲置资金需要配置的可以联系理财顾问【岳先正13880283801】或95536转9【国信证券】,1,,
数着指头盼五一，提前放松一下吧！《武道球魂》：功夫足球救世主急袭！以武之名，燃梦激情，让足球闪耀光芒！漫赏一下吧 http://139url.cn/95phxf,1,,
21日早盘建仓[300223北京君正]明天炫目拉涨![中金岭南]早盘获利4％!实力为证!加盟合作请速热线:18011783566[广信理财],1,,
"尊敬的陈广大,欢迎乘坐3月30日20:45大连-北京CZ6127,座位号50K,登机序号029,经济舱,请持二代身份证或护照于航班起飞前35分钟到达机场南航柜台打印登机牌并办理行李托运,航班起飞15分钟前到达登机口,登机口13.登机口变更请留意机场服务信息。如需取消座位,请回复:QX证件号码.【南航】",0,,
青、中、老年人有了新的划分，赶紧来看看你还算青年吗？科学刷牙方法曝光，令众人唏嘘，你刷对了吗？详击：http://180.3gbc.cn/?a=138801,1,,
Ok anyway no need to change with what you said,0,,
You need to get up. Now.,0,,
"I av a new number,  . Wil u only use this one,ta.",0,,
今日我机构午盘携资金带领客户介入601588北辰实业，明日拉升，预计收益5以上。全国合作建 仓热 线：4000287198【博瑞信息】,1,,
Yes there were many sweets,0,,
You're gonna have to be way more specific than that,0,,
毕节聂三耳鹅肠火锅5月25日隆重开业，百余种菜品任您挑选！每客38元，指定酒水免费，地址：洪南水果批发市场大门口。订餐电话：8988222,1,,
尊敬的客户，今天是您的生日，在这属于您的特殊日子里，招行祝您生日快乐，幸福安康！更多金融服务请致电95555，我们随时为您服务！[招商银行],0,,
"城市快讯：任志强反驳房价太高：胸罩比房子贵得多,详情请点击：http://city.jx139.com/m?a=2b1d3b7ecI865025S2160M1",1,,
You got called a tool?,0,,
Tell them u have a headache and just want to use 1 hour of sick time.,0,,
太平广场（太平禅寺）有经营用房招租，可经营超市、茶楼、素餐馆等。电话13861361278 详情登陆 www.yzszyl.com【园林处】,1,,
I jus reached home. I go bathe first. But my sis using net tell u when she finishes k...,0,,
11月24至30日是首届国家网络安全宣传周，我们号召全民提高网络安全意识，共建网络安全，共享网络文明！【中央网信办、工信部、中国移动】,0,,
Me too. Mark is taking forever to pick up my prescription and the pain is coming back.,0,,
很好很好,0,,
还在担心骚扰电话，隐私泄漏么？让“360手机安全卫士”为你保驾护航吧，一键式安全扫描，手机加速，为您带来全方位隐私保护，让手机卸掉重担，运转如飞！亲，联通用户免流量费下载哟！下载地址：       http://hao.hb165.com/i/1/FFcQszlQ,1,,
150万起享89平精装复式四房！【金地名峰】教育医疗沃尔玛交通一步到位！开盘在即，团购预定中，周末到访赢后街男孩演唱会门票28366333,1,,
尊贵的主人！我是您订购的宝贝包裹啊！我体检优秀，状态上佳，京东配送员正背着我驰骋狂奔，转瞬即到，快领我回家啊。【JD.COM京东】,0,,
给别人说好没得，,1,,
我们可以为你办一个和别人一样的手&机号.他和别人说什么.发什么你同时可以知道，他不会发现，可先试.详情询：182 2760 1511 王,1,,
专家呼吁增设春夏小长假[新浪]-中国移动冲浪助手:http://go.10086.cn/nd/meU/VWzyy,1,,
Awww dat is sweet! We can think of something to do he he! Have a nice time tonight ill probably txt u later cos im lonely :( xxx.,0,,
1月09日，星期四，最低气温-9℃，最高气温-3℃，晴，北风 5-6级 转 西北风 4-5级。,0,,
【京东】尊敬的客户，您的订单（7091229316）已出库发货，正在配送中，请您耐心等待。京东不会以订单无效为由主动要求您提供银行卡信息操作退款，谨防诈骗！如需退订，请回复CKTD。,0,,
She went to attend another two rounds today..but still did't reach home..,0,,
"Had your contract mobile 11 Mnths? Latest Motorola, Nokia etc. all FREE! Double Mins & Text on Orange tariffs. TEXT YES for callback, no to remove from records",1,,
【KK娱乐】宋承宪晒与林志玲合影 网友留言调侃称“在一起”       http://ah.kk3g.net/i/1/jOUZ36fI,1,,
【大众点评】384309（大众点评网预订验证码，请完成验证），如非本人操作，请忽略本短信。,0,,
I just made some payments so dont have that much. Sorry. Would you want it fedex or the other way.,0,,
翠叠园近期必卖房，155平板楼三居室。户型格局好，送学区名额，此房不要交个税，有钥匙看房随时。绝对是您的菜，小单：182-1017-9108,1,,
You are a winner U have been specially selected 2 receive å£1000 cash or a 4* holiday (flights inc) speak to a live operator 2 claim 0871277810810,1,,
您好！截至到2014年07月25日17时40分，您已使用数据流量272.35MB，其中套餐外流量272.35MB，已产生套餐外流量费用0.0元，套餐内剩余流量20.0MB，感谢您使用流量查询服务。中国移动,0,,
您好，您的快件1161025727103，预计今日内送达北京市朝阳区建国路88号soho现代城1号楼507，请注意查收。如您不方便接收，请致电揽投员陈健鹏18911238890联系。关注EMS微信服务号ems-cnpl并绑定手机，可在线下单并获得邮件最新状态！中国邮政EMS,0,,
你好，大唐S18 4.5寸屏 （乐享话费包） 530.00   十台送一台  欲购从速  联系电话13919999908[兰州兴盛嘉源电子科技有限公司],1,,
老师也要表演，六一不因该是让小朋友发挥他们天赋的时候吗？还要老师表演，这就有点……,1,,
你好，我行为企业，个人提供小额贷款，方便快捷，当天放款，有意详询，13925571726杨经理。,1,,
汉正古镇准现房热销中，购房现金钜惠。新品房源即将认筹，仿古商业街临街旺铺接受咨询，来访即赠精美水杯，老带新送购物卡8105222【数字技术】,1,,
You have WON a guaranteed å£1000 cash or a å£2000 prize.To claim yr prize call our customer service representative on,1,,
Congrats! Nokia 3650 video camera phone is your Call 09066382422 Calls cost 150ppm Ave call 3mins vary from mobiles 16+ Close 300603 post BCM4284 Ldn WC1N3XX,1,,
I didnt get anything da,0,,
Someone has conacted our dating service and entered your phone because they fancy you!To find out who it is call from landline 09111030116. PoBox12n146tf15,1,,
You stayin out of trouble stranger!!saw Dave the other day heåÕs sorted now!still with me bloke when u gona get a girl MR!ur mum still Thinks we will get 2GETHA! ,0,,
"[Û_] anyway, many good evenings to u! s",0,,
Finished class where are you.,0,,
She's borderline but yeah whatever.,0,,
"你好，中信集团长期在本地发放小额贷款，.免抵押，免担#保^，年息15， 当天办理可放款。联#；13|/8|57744114,刘|经理。",1,B,"你好，中信集团长期在本地发放小额贷款，免抵押，免担保，年息15， 当天办理可放款。联；13857744114,刘经理。"
\HEY KATE,0,,
Congrats ! Treat pending.i am not on mail for 2 days.will mail once thru.Respect mother at home.check mails.,0,,
Wen did you get so spiritual and deep. That's great,0,,
"颜含（887350789)希望加您为飞信好友:360学院 颜含""同意回复Y",0,,
URGENT! We are trying to contact U. Todays draw shows that you have won a å£800 prize GUARANTEED. Call 09050001808 from land line. Claim M95. Valid12hrs only,1,,
"Almost there, see u in a sec",0,,
"尊敬的移动用户:现中国移动铁通光宽带特别推出以下优惠活动:4M宽带免费送,预存660元话费送660元话费,再送15个月宽带时长. (660元话费其中420元一次性到账，剩下240元分12个月返还，每月返20元),咨询电话:13996327993,程明辉. 数量有限,办完即止! 重庆市移动弹子石营销中心",1,,
国内短信费：23.80元,0,,
【紫阙台】新品房源加推，火爆热銷中！携手11家国际一线品牌，108-199平米奢适精装大宅，稀缺9层低密度准現房。询5555556,1,,
亲，小当来事儿了，每月一：5月21至24日，40万种图书全场5折封顶！“图书5折”小当标，每月回不失约！要书得紧【当网】,1,A,亲，小当又来事儿了，每月一次：5月21至24日，40万种图书全场5折封顶！“图书5折”是小当的标签，每月一回绝不失约！要买书得赶紧【当当网】
UR GOING 2 BAHAMAS! CallFREEFONE 08081560665 and speak to a live operator to claim either Bahamas cruise ofå£2000 CASH 18+only. To opt out txt X to 07786200117,1,,
查询余额服务：您总账户余额为18.36元。详情为：主账户余额18.36元，副账户余额0.00元。感谢您的使用，中国移动。,0,,
刘畅:咱们周一早上9点55那班国航的吧，航班号CA1415,0,,
Can Ì_ all decide faster cos my sis going home liao..,0,,
【北京招行】招商银行已为您开放专享产品“朝朝盈”，1分钱起购，7*24小时赎回，资金0秒到账，12月1日年化收益率4.165%，下载手机银行购买http://e95555.cn/uNmNUA[东四环刘方舟18611928223],0,,
"Turns out my friends are staying for the whole show and won't be back til ~ &lt;#&gt; , so feel free to go ahead and smoke that $ &lt;#&gt;  worth",0,,
请帮忙汇2000元人民币到以下账号，6221885912003302595  账户名：林国业，中国邮政。谢谢。,1,,
温馨提示，截止11月30日24时，您当月套餐内流量已使用223.09MB，剩余流量76.91MB。登录 wap.10010.com 直充话费，方便又打折!,0,,
December only! Had your mobile 11mths+? You are entitled to update to the latest colour camera mobile for Free! Call The Mobile Update Co FREE on 08002986906 ,1,,
中央豪庭70-140两室-三室多种户型，东城核心绝版位置，学区房，紧邻中央商务区、行政办公区与东凯小学，徐丰华：13706478351,1,,
美媒曝光中国地下空军:不可战胜[搜狐]-中国移动冲浪助手:http://go.10086.cn/nd/mgp/17a7CF,1,,
Are you there in room.,0,,
"Thanks for your ringtone order, reference number X49.Your mobile will be charged 4.50. Should your tone not arrive please call customer services 09065989182",1,,
本周六日大型澳大利亚房产展在广州圣丰索菲特酒店3楼举行，永久产权精装别墅，澳洲房产移民一站式服务，澳信集团4001122388【宏达佳】,1,,
美媒曝光中国地下空军:不可战胜[搜狐]-中国移动冲浪助手:http://go.10086.cn/nd/mgp/16Y6e2,1,,
My drive can only be read. I need to write,0,,
纸袋碰腿北京2孕妇地铁内互殴[人民]-中国移动冲浪助手:http://go.10086.cn/nd/mgV/N4G0Q,1,,
Shopping? Eh ger i toking abt syd leh...Haha,0,,
9月7-9日广州有机食品展广交会馆举行，上百家绿色有机食品展商已参与，美国、韩国、瑞士、香港等国际展团亮相02084120550【振威展览】,1,,
新品别墅升级上市，140万起，150-180平，户户通温泉，不限购，赠庭院、地下室、大露台，认筹2万抵10万，4000112656[房讯通],1,,
专家呼吁增设春夏小长假[新浪]-中国移动冲浪助手:http://go.10086.cn/np/meO/14cq0l,1,,
"U've been selected to stay in 1 of 250 top British hotels - FOR NOTHING! Holiday valued at å£350! Dial 08712300220 to claim - National Rate Call. Bx526, SW73SS",1,,
您参与的‘动感秋季迎新-承诺消费优惠’活动，本月返还话费20元，已注入副账户。祝您消费愉快。,0,,
Ding me on ya break fassyole! Blacko from londn,0,,
Thanks for your message. I really appreciate your sacrifice. I'm not sure of the process of direct pay but will find out on my way back from the test tomorrow. I'm in class now. Do have a wonderful day.,0,,
Me fine..absolutly fine,0,,
Omg I want to scream. I weighed myself and I lost more weight! Woohoo!,0,,
"Nothing really, just making sure everybody's up to speed",0,,
全球首款动作格斗手机网络游戏“王者之剑”，重现街机时代操作辉煌，华丽画面，流畅战斗，成就实力格斗之王！即日起湖北联通用户可免流量费下载，格斗冲关激情，给你炫酷体验，让你欲罢不能！免流量费下载地址：       http://hao.hb165.com/i/1/gyRrtUXS,1,,
"Urgent -call 09066649731from Landline. Your complimentary 4* Ibiza Holiday or å£10,000 cash await collection SAE T&Cs PO BOX 434 SK3 8WP 150ppm 18+",1,,
So can collect ur laptop?,0,,
There is no sense in my foot and penis.,0,,
