text,label,attack_type,original_text
When is school starting. Where will you stay. What's the weather like. And the food. Do you have a social support system like friends in the school. All these things are important.,0,,
Theyre doing it to lots of places. Only hospitals and medical places are safe.,0,,
【大众点评】 亲爱的会员，恭喜您获得大众点评5.0元抵用券，马上用此手机号购买团购吧。http://dpurl.cn/m/coupon 【大众点评】,0,,
您好！截至到2014年04月07日16时02分，您定制的（1）预存返话费捆绑10元流量包，数据流量剩余70.0MB，本地移动数据流量剩余10.37MB，（2）全球通88商旅套餐，语音剩余302分钟，数据流量剩余30.0MB，（3）全球通套餐专属短信包，短信剩余31条，感谢您的使用。中国移动,0,,
Hi darlin im on helens fone im gonna b up the princes 2 nite please come up tb love Kate,0,,
Thank You meet you monday,0,,
您账户1407于10月04日10:24直付通/快捷支付扣款人民币18.00[招商银行],0,,
"价格才是王道,性价比胜过一切!世博花园首批房源两小时售磐,18号楼循众加推,速抢!86578666",1,,
"您尾号7544卡29日16:39ATM支出(ATM取款)2,000元。【工商银行】",0,,
"双色球 第2014028期开奖号码:06,16,21,27,30,32:05。双色球自选回“S#投注号码*倍数”（投注号码为6个红球1个蓝球，多注用#隔开，最大为5注），回复HS获取更多双色球帮助信息。其他彩种帮助信息回复“H+彩种代码”，如回HD获取大乐透帮助信息。【中国移动手机彩票】",0,,
【脉脉】杜海艳(职脉  全职行业总监)、王旭燕(安利中国日用品有限公司高级经销商)、周小韬(百度Android  高级开发，IOS高级开发)共3人在“脉脉”上发消息给您。如需回复请打开脉脉。http://t.cn/8FhH6Up  回复N退订,0,,
S/omeone #has contacted o.ur dat^ing #s~erv#~i/ce and enter/ed your ph_o_ne because /they fan#*cy you! To find out who it*. i|s call# f/.rom a landline| 091~11032124 .~ PoBox12n146tf150p,1,B,Someone has contacted our dating service and entered your phone because they fancy you! To find out who it is call from a landline 09111032124 . PoBox12n146tf150p
Dunno i juz askin cos i got a card got 20% off 4 a salon called hair sense so i tot it's da one Ì_ cut ur hair. ,0,,
I liked your new house,0,,
Good Morning my Dear........... Have a great &amp; successful day.,0,,
Sac will score big hundred.he is set batsman:-),0,,
财富收盘版：指数如早盘所示维持震荡格局，部分前期调整较为充分、具备政策面扶持的板块及优质个股表现突出，呈现结构性机会。投资建议仅供参考。如需取消短信请回复000【招商证券】,0,,
Still chance there. If you search hard you will get it..let have a try :),0,,
纸袋~碰^腿北京_2孕妇地铁内互殴[人民]-中国移动冲浪助手:http:/^/go^_.10|086.c^n/nd/mh9/wST2w,1,B,纸袋碰腿北京2孕妇地铁内互殴[人民]-中国移动冲浪助手:http://go.10086.cn/nd/mh9/wST2w
Aiyar dun disturb u liao... Thk u have lots 2 do aft ur cupboard come...,0,,
No..he joined today itself.,0,,
莫荣寿:成交快讯：恭喜A组黄海灵成交一售，恭喜恭喜大家齐齐开单！！,1,,
您好，您已成功下单，请静候收派员上门。关注顺丰微信“顺丰速运”快速下单、查询！【顺丰速运】,0,,
S.this will increase the chance of winning.,0,,
5月22日珍悦轩粤菜海鲜酒楼夏季海鲜节隆重开幕，海鲜品种全市最齐、价格最低，活鲍套餐158元/位，详询6262888,1,,
360艾永春:泰康的人过来谈诈骗先赔的页面设计，约周五下午2点如何？,0,,
Gd luck 4 ur exams :-),0,,
生活是一个陀螺，转起了忙乱的日子；惦记是一根风筝线，牵起远近的情意；幸福是一朵云烟，轻轻笼在你身边；快乐是一袭花香，伴你开心每一天。,0,,
金征远特邀澳洲官员、律师来华解读重大投资移民项目，现场制定一对一移民方案。资金投到政府国债，安全可靠一步到位拿身份！4007006541,1,,
纸袋碰腿北京2孕妇地铁内互殴[人民]-中国移动冲浪助手:http://go.10086.cn/nd/mh5/Uq6TA,1,,
【减肥方法大全】爱美是女人的天性，每个女性都渴望拥有完美身材。本软件收集整理了大量的减肥方法、快速减、减肥食谱、减肥操、明星减肥、健康减肥、科学减肥、运动减肥方法，利用您的碎片时间学习一下吧http://down.mumayi.com/289263,1,,
入驻东二环最后机遇！现推限量86平恒温恒湿科技精装户型，独享连廊泳池、百老汇影院、171重点中学配套4006000756【当代MOMA历峰】,1,,
network operator. The service is free. For T & C's visit 80488.biz,1,,
您好！截至到2014年11月24日19时45分，您定制的（1）20元终端特惠套餐包，数据流量本地剩余0.0MB，（2）40元数据流量套餐（4G），数据流量剩余610.47MB，（3）58元300分钟语音套餐（4G），语音剩余115分钟，（4）10元200条短信套餐（4G），短信剩余151条，感谢您的使用。查流量、查话费、办业务、优惠早知道！就用“北京移动”手机客户端。点击下载： http://mobilebj.cn/?c=113/  中国移动,0,,
I bought the test yesterday. Its something that lets you know the exact day u ovulate.when will get 2u in about 2 to 3wks. But pls pls dont fret. I know u r worried. Pls relax. Also is there anything in ur past history u need to tell me?,0,,
老婆请问你是什么意思呀？死什么死呀。是不是谁或又说错什么得罪？？？,1,,
【交通银行】(2/2)95559。回复TD可退订。,0,,
有房产/车辆急用钱？短期应急，当日下款！银行贷款5日批贷，已有贷款房可按新的市值7成至满成二次贷款！详询赵雪4006625998【华夏永泰】,1,,
【腾讯科技】你的微信帐号deeplyfun找回帐号密码失败，回执单号37267885。查看原因http://url.cn/UZI9YR,0,,
广渠门支行5月22日起售183-365天理财，10万起购，收益4.8-5.0，详询理财经理电话67184883 671,1,,
【139邮箱登录安全提醒】欢迎您于11-17 15:58从电脑登录139邮箱，如非您本人登录，可回复SD锁定邮箱，回复X取消提醒。,0,,
ok，多谢！,0,,
品牌团5月13日0点开团啦~宋慧乔款69元起http://shop.paipai.com/855008046【秋水伊人QQ网购旗舰店】,1,,
乐享无线城市，五月好运好礼领航！新用户成功注册就抽奖，老朋友幸运号码赢好运。辽宁无线城市诚邀新友、旧交一起来把精彩好礼抱回家！详情点击：http://shenyang.wap.wxcs.cn,1,,
Wait.i will come out.. &lt;#&gt;  min:),0,,
WOT STUDENT DISCOUNT CAN U GET ON BOOKS?,0,,
美媒曝光中国地下空军:不可战胜[搜狐]-中国移动冲浪助手:http://go.10086.cn/nd/mgE/Jaj7J,1,,
Yes when is the appt again?,0,,
I thought slide is enough.,0,,
鲁能三亚湾礼献冰城，5月25日14：30齐鲁国际酒店，60-90平亲海公馆，2万抵20万，到场有礼18689638386【易居购房网】,1,,
【京东】您于10月24日12时14分消费京券100元。有疑问请致电400-606-5500转7,0,,
流量送礼大抽奖火热进行中！本月流量使用达50M以上客户即可参与联通20元充值卡抽奖，每月抽取三次，还等什么，本期大奖可能就是你；Iphone和A套餐用户本月套内流量使用超过100，还可参与20名IPAD MINI抽奖，套内流量不浪费！（乐视视频 http://m.letv.com 15元包6G封顶视频随意看）,1,,
"""截止到2014年04月09日，您的帐户当月可用余额为0.00元。",0,,
"""【中传视讯】“原来”的手机号绑定验证码为16:50:09",0,,
"life alle mone,eppolum oru pole allalo",0,,
5月24－26日国美和谐广场店联手创维彩电惊世钜惠，享三重补贴，更有订金翻倍用再增8GU盘，42吋3D智能网络LED补贴后2999元，47吋3D智能网络LED补贴后3799元，55吋健康云电视补贴后6599元，58吋健康云电视补贴后5999元，详情咨询81615398【创维集团】,1,,
纸袋碰腿北京2孕妇地铁内互殴[人民]-中国移动冲浪助手:http://go.10086.cn/nd/mh5/pUPcL,1,,
【外教一对一】纯英文浸泡式环境，一步到位突破外语，成人、小孩想学就学，超低优惠，免费体验02164226007,1,,
Xy trying smth now. U eat already? We havent...,0,,
"Nah, Wednesday. When should I bring the mini cheetos bag over?",0,,
即日起至6月21日，东风日产夏季服务活动期间，我们将^/为您的爱车提供空调免费检测等^服务，到店更有多重惊喜_*！*详询626120~_26.【锦江】,1,B,即日起至6月21日，东风日产夏季服务活动期间，我们将为您的爱车提供空调免费检测等服务，到店更有多重惊喜！详询62612026【锦江】
尊敬的会员，您的预约打车已被司机抢单，司机电话13910974390，车牌号京BP4112。请及时和司机联系确认哦！【快的打车】,0,,
"Yes, princess. Toledo.",0,,
&lt;#&gt;  am I think? Should say on syllabus,0,,
家长：中考28天“短训”速提60分！名师1对1精讲数理化英“必考点、常考题”掌握高分技巧，稳过分数线！咨67952686,1,,
诺心芒果季上市！芒果流心，芒果芒果，芒果拿破仑。5.31前优先体验有惊喜！www.lecake.com【诺心LECAKE】,1,,
There r many model..sony ericson also der.. &lt;#&gt; ..it luks good bt i forgot modl no,0,,
住建部6月-8月在南京、北京、广州、兰州举办2013版《建设工程工程量清单计价规范》培训，该规范7月1日实施。张爱玲：13146013208,1,,
【招商证券】财富早间版：沪港通或10月份启动，逾300券商申请试点；住建部要求加快城市道路桥梁建设，公路建设投资有望加速。新股申购抽离资金预期令市场主力态度谨慎，稳健者等待回调低吸主板优质品种如券商、医药、高铁、核电等的操作机会。投资建议仅供参考。,0,,
"I keep seeing weird shit and bein all \woah\"" then realising it's actually reasonable and I'm all \""oh\""""",0,,
"HOT LIVE FANTASIES call now 08707509020 Just 20p per min NTT Ltd, PO Box 1327 Croydon CR9 5WB 0870..k",1,,
胡奇好:星期五试你把密码告诉下我吧有学号,1,A,胡昊奇好奇:星期五考试你把密码告诉下我吧还有学号
Lol for real. She told my dad I have cancer,0,,
选择万科，选择北杭州新中心-北宸之光30万方巨著!上塘高架直达，鼎成万科三好住宅，90-130方装修臻品，6月示范区震撼启幕88767999,1,,
"18606005051贵宾:苹果4S念版仅699元限50台,限号今日秒杀!http://4061.skyali.net",1,A,"18606005051贵宾:苹果款4S纪念版仅699元限50台,限本号今日秒杀!http://4061.skyali.net"
iPhone6 16G公开版深空灰，现货首发限量抢购，月供仅457元，立即编辑短信“MS67”发送到“9551186”，享平安信用卡分期免息购！还有机会得150万积分大奖！详见  wanlitong.com/i3  。,0,,
I not busy juz dun wan 2 go so early.. Hee.. ,0,,
您好！截至到2014年10月18日14时38分，您定制的（1）移动数据流量流量服务包，数据流量剩余10.0MB，（2）预存返话费捆绑10元流量包，数据流量剩余0.0MB，本地移动数据流量剩余0.0MB，（3）40元数据流量套餐（4G），数据流量剩余535.75MB，（4）58元300分钟语音套餐（4G），语音剩余47分钟，感谢您的使用。查流量、查话费、办业务、优惠早知道！就用“北京移动”手机客户端。点击下载： http://mobilebj.cn/ 中国移动,0,,
买好更要买缺，才是价值所在！老城区最后的多层电梯洋房，融侨上院10#限量加推，125-238平花园大宅，最高送88平65597999【融侨】,1,,
欢迎使用机场无线上网，您的验证码：3hb。广州机场祝您出行愉快。【机场无线】,0,,
买三居送一居！第二机场核心区85-115平瞰景洋房，4号线无缝接驳，首付19万起。致电享万元优惠，免费领水木年华门票 4000901203,1,,
"I am real, baby! I want to bring out your inner tigress...",0,,
Please CALL 08712402578 immediately as there is an urgent message waiting for you,1,,
Sday only joined.so training we started today:),0,,
【猎聘网】猎聘秘书台:18:18与您通话的是猎头聂亚男(ID号:LT1204025)可登录网站查询联系.请您回复短信对此次通话进行评价，1为满意，2为一般，3为不满意。,0,,
K:)k.are you in college?,0,,
美曝光中地下军:不可战胜[搜狐]-中国移冲浪助手:http://go.10086.cn/nd/mgM/L5XrA,1,A,美媒曝光中国地下空军:不可战胜[搜狐]-中国移动冲浪助手:http://go.10086.cn/nd/mgM/L5XrA
Got but got 2 colours lor. One colour is quite light n e other is darker lor. Actually i'm done she's styling my hair now.,0,,
U buy newspapers already?,0,,
Prepare to be pleasured :),0,,
Wake me up at  &lt;#&gt;  am morning:),0,,
你好，建行推出个人与企业信誉贷5-200万，无需担~保，放款前无费用，需求者请联系：15201995399李经理,1,,
When u love someone Dont make them to love u as much as u do. But Love them so much that they dont want to be loved by anyone except you... Gud nit.,0,,
You will go to walmart. I.ll stay.,0,,
六号线首站，低价大盘，首付19万，83平两居，不限购，纯板楼，70年大产权，百步即享百亿城市配套，4006562316.,1,,
【滴滴打车】(6627)滴滴打车验证码,0,,
房屋出租：位于华安一中体育场后面华鑫小区整幢5层套房出租，楼房全部新建精装修，有意者详询：13959665983【华福】,1,,
今午盘以15.5元左右带内部会员全仓买入【300223】，明早盘有望大涨！请勿追买！详 询：15574752123【国富咨询】,1,,
Do u still have plumbers tape and a wrench we could borrow?,0,,
No no. I will check all rooms befor activities,0,,
Hi Chachi tried calling u now unable to reach u .. Pl give me a missed cal once u c tiz msg  Kanagu,0,,
【1号团】汇康 头层牛皮坡跟凉鞋，两款可选！仅售88元全国包邮！火热疯抢中http://t.cn/zH2yS92 【1号商城】,1,,
中國信託訊息限當筆有效。請確認網頁識別碼XMUD輸入OTP密碼0068044設定定期定額預約轉帳交易,1,,
温馨提示！【长向优代发】【期外惠开票】急需可联系曾，13815883848商！打！请见谅！,1,A,温馨提示！【长向优代发】【期外惠开票】急需可联系曾经理，13815883848商谈！如有打扰！请见谅！
Will you be here for food,0,,
Never blame a day in ur life. Good days give u happiness. Bad days give u experience. Both are essential in life! All are Gods blessings! good morning.:,0,,
I'll be in sch fr 4-6... I dun haf da book in sch... It's at home...,0,,
Natalie (20/F) is inviting you to be her friend. Reply YES-165 or NO-165 See her: www.SMS.ac/u/natalie2k9 STOP? Send STOP FRND to 62468,1,,
"Each Moment in a day,has its own value-Morning brings hope,afternoon brings faith,Evening brings luv,Night brings rest,Wish u find them all today.Good Morning",0,,
"\What are youdoing later? Sar xxx\""""",0,,
【唐家欧美】尊敬的唐家会员：12月1日至9日，双12百款特供新品会员抢先享受双12疯抢价tanghouse.m.taobao.com,0,,
本周六日大型澳大利亚房产投资展在上海四季酒店3楼举行，永久产权首付1成，澳洲房产移民留学一站式服务。澳信集团4001825388【深德兰】,1,,
【北京公共卫生热线】卫生政策，健康咨询，就医指南，投诉举报······北京12320，您身边的健康咨询顾问。拨打12320，贴心服务零距离。,0,,
商务报联播【手访问http://ec.cn】1）国在集片特困地加强发性金融扶贫；2）中国成为球第二大务包接包国；3）4月份统计数据示房环比涨幅7个月来首降。【商务部电商务心-商信通】,1,A,商务简报联播【手机访问http://ec.cn】1）我国将在集中连片特困地区加强开发性金融扶贫；2）中国成为全球第二大服务外包接包国；3）4月份统计数据显示房价环比涨幅7个月来首降。【商务部电子商务中心-商信通】
【惠阳碧桂园山河城】精装美墅5800元/平起，福田公寓总价买别墅。马来西亚投资考察团4天3夜游邀您参加，现在报名减两千07523737888,1,,
不做巴菲特，不做索罗斯，只做涨T板，南易涨T板俱乐部马上将要埋伏在连续三个涨停板的个股，领先一步，步步领先！4006547800【南易基金】,1,,
"王媛媛（15904952599)希望加您为飞信好友:您好 我是手机卫士HR王媛媛""同意回复Y",0,,
"Christmas is An occasion that is Celebrated as a Reflection of UR... Values..., Desires..., Affections...&amp; Traditions.... Have an ideal Christmas...",0,,
买三居送一居！第二机场核心_/区85-11|5平瞰景洋房，4号线无缝接驳/，首付19万起。致电享#万元#^优惠，免|费领水木年华门票 400090120^3~,1,B,买三居送一居！第二机场核心区85-115平瞰景洋房，4号线无缝接驳，首付19万起。致电享万元优惠，免费领水木年华门票 4000901203
Wat makes u thk i'll fall down. But actually i thk i'm quite prone 2 falls. Lucky my dad at home i ask him come n fetch me already.,0,,
八年级成绩要拔高，一线教师1对1，系统诊断期中考，教方法讲重点难点，查漏补缺，夯实基础，协议提高，拿高分提名次66285675【北大名师】,1,,
公司庆祝【8周年】活动，凡是今天打进电话的一律五折优惠！预约电话；400-6289775现代投资【国富咨询】,1,,
应该会刷新，不过你纠错了就没办法了。,0,,
Ugh fuck it I'm resubbing to eve,0,,
难以置信！一江西女童8个月大乳房发育，一岁时便来月经，到底是什么原因？详情点击http://wap.189hz.com/r/mQBJRn,1,,
炎炎夏日到，中大送清凉，即日起到6月30日，凭短信可享受中大福特4S店免费空调系统健诊、免费软件升级，更可限量抢购低至66折保养套餐。行动吧，去中大！预约热线87277186【诸暨中大】,1,,
特惠！7980元/平起！可贷款，不限购！首都机场商圈五星级公寓，一居两居、复式户型多样，地铁15和L1线直达。热线：01056247673,1,,
想在短时间内学好外语吗？请个外/教吧！一对一授课，月均仅需千余元，一步到位学好外语！学不会不收费！详询86086567【哈迪森】,1,,
I don't want you to leave. But i'm barely doing what i can to stay sane. fighting with you constantly isn't helping.,0,,
Watching ajith film ah?,0,,
Come to my home for one last time i wont do anything. Trust me.,0,,
您账户1407于11月11日09:04发生【支付宝】的直付通/快捷支付扣款人民币1.00[招商银行],0,,
融汇财富携手银行合作，免抵押免担保贷款，月利息9哩，最高贷款额度50万，按揭中房产再贷款，详询：15980020168【国际经济】,1,,
"I've not called you in a while. This is hoping it was l8r malaria and that you know that we miss you guys. I miss Bani big, so pls give her my love especially. Have a great day.",0,,
Shall i start from hear.,0,,
贺昨日客户建的【万泽股份】高开大涨6！庆五一公司现对散户作出巨大优惠，限前30名散户！建仓专线：4000866895【鼎兴基金】,1,,
Y_ou ha*ve won a g.uaranteed å£200. award or |eve/^n å£1|~000_ casht/o/_ cla/im UR award ca^ll free on 08000407165 (18#+) 2 s/top getstop on 88#|222 PHP,1,B,You have won a guaranteed å£200 award or even å£1000 cashto claim UR award call free on 08000407165 (18+) 2 stop getstop on 88222 PHP
别删！这绝对是个不容错过的好消息！海珀晶华最后6席公开，正虹桥富人区，21米面宽，8.7米挑高，全套房设计，私家电梯59766088,1,,
"I know where the  &lt;#&gt;  is, I'll be there around 5",0,,
[PUSH]-留神点!4种女人婚后最易出轨 详情点击,1,,
I am not sure about night menu. . . I know only about noon menu,0,,
尊敬的姜燕北先生，根据综合信用评分，您的个人卡账户额度已经从40000元上调至50000元人民币，回复#ED随时查询可用额度。巧用额度理财，猛戳 t.cn/8Fdn3VH 查询[招商银行],0,,
5.17日至5.1|9^日拨打联通114预定关东^文化_园门票，/都市温泉享受/，尽_享贵宾服务，低价格高品质。详情请拨打*114。,1,B,5.17日至5.19日拨打联通114预定关东文化园门票，都市温泉享受，尽享贵宾服务，低价格高品质。详情请拨打114。
我们公司今天带客户9元，重仓买入000060中金岭南明天必暴 涨，重点关注，切勿追高，合作热线020-29053718【达富投资】,1,,
Please sen :)my kind advice :-)please come here and try:-),0,,
南*_滨路^核心地段#.，临江一、二楼旺铺80-4/20㎡，买一层送一层；一线江景豪宅-大平层1^14-338㎡；询18502/372/720【祝万_事如意】,1,B,南滨路核心地段，临江一、二楼旺铺80-420㎡，买一层送一层；一线江景豪宅-大平层114-338㎡；询18502372720【祝万事如意】
"交房即收租！平度新城核心20-900平百万级财富珍藏，年收益可超9％,包租包回购！零风险，抗通胀，高回报，全城抢购中82303333",1,,
I told her I had a Dr appt next week. She thinks I'm gonna die. I told her its just a check. Nothing to be worried about. But she didn't listen.,0,,
您好！截至到2014年09月14日15时57分，您已使用数据流量168.08MB，其中套餐外流量8.88MB，已产生套餐外流量费用4.54元，套餐内剩余流量100.8MB，感谢您使用流量查询服务。中国移动,0,,
"TheMob> Check out our newest selection of content, Games, Tones, Gossip, babes and sport, Keep your mobile fit and funky text WAP to 82468",1,,
FreeMsg Today's the day if you are ready! I'm horny & live in your town. I love sex fun & games! Netcollex Ltd 08700621170150p per msg reply Stop to end,1,,
让出国留学不花钱。美国投资移民全家快速获绿卡，加拿大省提名最后冲刺，魁省即将重启。子女免费优先读美名校。亨瑞 86222786,1,,
CERI U REBEL! SWEET DREAMZ ME LITTLE BUDDY!! C YA 2MORO! WHO NEEDS BLOKES,0,,
This is hoping you enjoyed your game yesterday. Sorry i've not been in touch but pls know that you are fondly bein thot off. Have a great week. Abiola,0,,
【去哪儿网】您预订的12月31日入住，厦门海港英迪格酒店英迪格海景房(无早/宽带免费)(大/双床)1间，已提交成功，确认有房，请尽量在30分钟内支付。订单号s3kk141226115630529。为保障您的资金安全，请确保只使用网上支付。住客：010-89678398,0,,
一次见效，无恢复期。金澜不开刀不手术男女士面部提升、祛皱纹眼袋、祛黄祛斑、丰胸减@肥、立体精雕。十五年经验，随做随走010-56299108,1,,
【阿姨帮】(预约成功)11月18日 13:00，SOHO现代城1号楼507，。保洁员：郭红恩，电话：13126626245,0,,
尊敬的客户，您查询的信息如下：中国银行北京东大桥路支行 地址：地址：北京市朝阳区东大桥路8号尚都国际中心Ａ座102、103号房邮编：100020 电话：对私58700438对公58700433理财58700435贷款58700438/58700435传真58700432，以上信息仅供参考。［中国银行］,0,,
首付2万玩转梅溪湖，月供750甩掉包租婆！你还租房干什么！22至30岁美女凭身份证和租房协议至【九公馆】看房百元购物卡疯狂拿88888555,1,,
"\Happy valentines day\"" I know its early but i have hundreds of handsomes and beauties to wish. So i thought to finish off aunties and uncles 1st...""",0,,
您好！截至到2014年08月13日17时14分，您定制的（1）预存返话费捆绑10元流量包，数据流量剩余42.72MB，本地移动数据流量剩余0.0MB，（2）全球通88商旅套餐，语音剩余173分钟，数据流量剩余30.0MB，（3）全球通套餐专属短信包，短信剩余84条，感谢您的使用。中国移动,0,,
美团：您的3份好迪KTV唱套美团券密码1068 4022 3988、1026 2787 6853、1085 6246 5149，,1,A,美团：您的3份好乐迪KTV欢唱套餐美团券密码1068 4022 3988、1026 2787 6853、1085 6246 5149，
"I'm not sure, I was just checking out what was happening around the area",0,,
联通5.17网购节23日结束！苹果5、三星NOTE2、千元智能机手机0元购，预存话费5折起，流量、话费赠不停。详情延边风采网、2514489,1,,
I went to ur hon lab but no one is there.,0,,
微信搜索“浦发银行信用卡中心”官方账号并加关注，参与点亮微梦想公益活动，照亮孩童梦。还能查账、还款、搜商户！服务多多、享乐更多！【浦发银行】,0,,
Reckon need to be in town by eightish to walk from * carpark.,0,,
"Sir, Waiting for your mail.",0,,
新股发行提示：1月23日申购732005晶方科技19.16元/股上限2.2万股。仅供参考，以沪深交易所公告为准。【招商证券】,0,,
"【招行北京金卡秘书】:热销理财300453号,预期年率5.3%,期限167天,每人限购5万,6号起售,售完即止,详询网点或95555.[回@5TD退订短信][招商银行]",0,,
春暖花开时，我们一起赏花可好？赏花好去处，尽在同程旅游，登录同程旅游 www.LY.com 开启您的赏花之旅，回复TD退订短信【同程】,0,,
尊敬的业主您好！杭州良工装饰临平分公司于5月25日（周六）下午13：00-17：00在临平世纪大道128号《富邦国际酒店》5楼举办专门针对您书香名邸专场设计户型解析会及征集样板房活动。诚邀您的参加！咨询热线：18967155528[良工装饰],1,,
